Ether / ARP who has 10.2.203.254 says 10.2.201.160 / Padding
Ether / IP / UDP 10.2.203.184:53038 > 239.255.255.250:1900 / Raw
Ether / ARP who has 10.2.203.254 says 10.2.200.185 / Padding
Ether / IP / UDP 10.2.202.184:mdns > 224.0.0.251:mdns / Raw
Ether / IPv6 / UDP fe80::d69a:20ff:fe23:6bef:mdns > ff02::fb:mdns / Raw
Ether / ARP who has 10.2.200.60 says 10.2.203.101 / Padding
Ether / IPv6 / UDP fe80::65b8:cda7:3c70:e030:dhcpv6_client > ff02::1:2:dhcpv6_server / DHCP6_Solicit / DHCP6OptElapsedTime / DHCP6OptClientId / DHCP6OptIA_NA / DHCP6OptClientFQDN / DHCP6OptVendorClass / DHCP6OptOptReq
Ether / IP / UDP 10.2.201.238:53638 > 239.255.255.250:1900 / Raw
Ether / ARP who has 10.2.1.205 says 10.2.1.254 / Padding
Ether / ARP who has 10.2.200.60 says 10.2.203.101 / Padding
Ether / ARP who has 10.2.7.19 says 10.2.7.249 / Padding
Ether / IP / UDP 10.2.2.2:60034 > 10.2.2.255:netbios_ns / NBNSQueryRequest
Ether / IP / UDP 10.2.2.11:57899 > 10.2.2.255:netbios_ns / NBNSQueryRequest
Ether / IP / UDP 10.2.203.184:53038 > 239.255.255.250:1900 / Raw
Ether / IPv6 / UDP fe80::65b8:cda7:3c70:e030:dhcpv6_client > ff02::1:2:dhcpv6_server / DHCP6_Solicit / DHCP6OptElapsedTime / DHCP6OptClientId / DHCP6OptIA_NA / DHCP6OptClientFQDN / DHCP6OptVendorClass / DHCP6OptOptReq
Ether / IP / UDP 10.2.2.1:50212 > 10.2.2.255:netbios_ns / NBNSQueryRequest
Ether / ARP who has 10.2.5.205 says 10.2.5.254 / Padding
Ether / ARP who has 10.2.200.60 says 10.2.203.101 / Padding
Ether / ARP who has 169.254.134.66 says 0.0.0.0 / Padding
Ether / ARP who has 10.2.7.205 says 10.2.7.254 / Padding
Ether / IP / UDP 10.2.200.60:61640 > 10.2.203.255:32414 / Raw
Ether / IP / UDP 10.2.200.60:61643 > 10.2.203.255:32412 / Raw
Ether / ARP who has 10.2.2.254 says 10.2.2.13 / Padding
Ether / IP / UDP 0.0.0.0:bootpc > 255.255.255.255:bootps / BOOTP / DHCP
Ether / ARP who has 10.2.201.195 says 10.2.203.254 / Padding
Ether / IP / UDP 0.0.0.0:bootpc > 255.255.255.255:bootps / BOOTP / DHCP
Ether / IP / UDP 10.2.2.4:1346 > 229.55.150.208:1345 / Raw
Ether / IP / UDP 10.2.2.4:61909 > 10.2.2.255:netbios_ns / NBNSQueryRequest
Ether / IP / UDP 10.2.203.184:53038 > 239.255.255.250:1900 / Raw
Ether / ARP who has 10.2.2.254 says 10.2.2.1 / Padding
Ether / ARP who has 10.2.7.205 says 10.2.7.254 / Padding
Ether / ARP who has 10.2.3.2 says 10.2.3.254 / Padding
Ether / ARP who has 10.2.203.254 says 10.2.200.185 / Padding
Ether / ARP who has 10.2.0.187 says 10.2.0.187 / Padding
Ether / IPv6 / UDP fe80::65b8:cda7:3c70:e030:dhcpv6_client > ff02::1:2:dhcpv6_server / DHCP6_Solicit / DHCP6OptElapsedTime / DHCP6OptClientId / DHCP6OptIA_NA / DHCP6OptClientFQDN / DHCP6OptVendorClass / DHCP6OptOptReq
Ether / ARP who has 10.2.201.193 says 10.2.203.254 / Padding
Ether / ARP who has 10.2.1.205 says 10.2.1.254 / Padding
Ether / IP / UDP 10.2.2.6:53287 > 10.2.2.255:netbios_ns / NBNSQueryRequest
Ether / IP / UDP 10.2.203.184:53038 > 239.255.255.250:1900 / Raw
Ether / ARP who has 169.254.134.66 says 169.254.134.66 / Padding
Ether / IP / UDP 10.2.2.7:51381 > 10.2.2.255:netbios_ns / NBNSQueryRequest
Ether / ARP who has 10.2.2.249 says 10.2.2.13 / Padding
Ether / ARP who has 10.2.2.254 says 10.2.2.8 / Padding
Ether / ARP who has 10.2.203.254 says 10.2.200.185 / Padding
Ether / ARP who has 10.2.2.254 says 10.2.2.4 / Padding
Ether / IP / UDP 10.2.2.18:54347 > 10.2.2.255:netbios_ns / NBNSQueryRequest
Ether / ARP who has 10.2.7.254 says 10.2.7.16 / Padding
Ether / ARP who has 10.2.5.205 says 10.2.5.254 / Padding
Ether / ARP who has 169.254.134.66 says 0.0.0.0 / Padding
Ether / ARP who has 10.2.2.254 says 10.2.2.5 / Padding
Ether / ARP who has 10.2.7.205 says 10.2.7.254 / Padding
Ether / IP / UDP 0.0.0.0:bootpc > 255.255.255.255:bootps / BOOTP / DHCP
Ether / IP / UDP 0.0.0.0:bootpc > 255.255.255.255:bootps / BOOTP / DHCP
Ether / ARP who has 10.2.2.254 says 10.2.2.18 / Padding
Ether / ARP who has 10.2.7.205 says 10.2.7.254 / Padding
Ether / IP / UDP 10.2.2.2:60034 > 10.2.2.255:netbios_ns / NBNSQueryRequest
Ether / IP / UDP 10.2.2.11:57900 > 10.2.2.255:netbios_ns / NBNSQueryRequest
Ether / ARP who has 10.2.5.14 says 10.2.5.254 / Padding
Ether / ARP who has 169.254.134.66 says 0.0.0.0 / Padding
Ether / ARP who has 10.2.2.254 says 10.2.2.15 / Padding
Ether / ARP who has 10.2.203.254 says 10.2.200.210 / Padding
Ether / IP / UDP 10.2.200.60:61640 > 10.2.203.255:32414 / Raw
Ether / IP / UDP 10.2.200.60:61643 > 10.2.203.255:32412 / Raw
Ether / IPv6 / UDP fe80::204a:76c7:f703:c7c5:dhcpv6_client > ff02::1:2:dhcpv6_server / DHCP6_Solicit / DHCP6OptElapsedTime / DHCP6OptClientId / DHCP6OptIA_NA / DHCP6OptClientFQDN / DHCP6OptVendorClass / DHCP6OptOptReq
Ether / IP / UDP 10.2.2.4:61909 > 10.2.2.255:netbios_ns / NBNSQueryRequest
Ether / IPv6 / UDP fe80::65b8:cda7:3c70:e030:dhcpv6_client > ff02::1:2:dhcpv6_server / DHCP6_Solicit / DHCP6OptElapsedTime / DHCP6OptClientId / DHCP6OptIA_NA / DHCP6OptClientFQDN / DHCP6OptVendorClass / DHCP6OptOptReq
Ether / ARP who has 10.2.2.254 says 10.2.2.12 / Padding
Ether / ARP who has 10.2.2.254 says 10.2.2.9 / Padding
Ether / ARP who has 10.2.203.254 says 10.2.200.210 / Padding
Ether / IP / UDP 10.2.0.249:netbios_ns > 10.2.0.255:netbios_ns / NBNSQueryRequest
Ether / ARP who has 169.254.134.66 says 0.0.0.0 / Padding
Ether / IP / UDP 10.2.0.2:netbios_ns > 10.2.0.255:netbios_ns / NBNSQueryRequest
Ether / ARP who has 10.2.0.2 says 10.2.0.3 / Padding
Ether / IPv6 / UDP fe80::204a:76c7:f703:c7c5:dhcpv6_client > ff02::1:2:dhcpv6_server / DHCP6_Solicit / DHCP6OptElapsedTime / DHCP6OptClientId / DHCP6OptIA_NA / DHCP6OptClientFQDN / DHCP6OptVendorClass / DHCP6OptOptReq
Ether / IP / UDP 10.2.2.6:53287 > 10.2.2.255:netbios_ns / NBNSQueryRequest
Ether / IP / UDP 10.2.0.249:netbios_ns > 10.2.0.255:netbios_ns / NBNSQueryRequest
Ether / ARP who has 10.2.203.254 says 10.2.200.210 / Padding
Ether / IP / UDP 0.0.0.0:bootpc > 255.255.255.255:bootps / BOOTP / DHCP
Ether / IP / UDP 10.2.2.7:51383 > 10.2.2.255:netbios_ns / NBNSQueryRequest
Ether / IP / UDP 10.2.2.18:54347 > 10.2.2.255:netbios_ns / NBNSQueryRequest
Ether / IP / UDP 10.2.0.249:netbios_ns > 10.2.0.255:netbios_ns / NBNSQueryRequest
Ether / IP / UDP 10.2.2.9:1346 > 229.55.150.208:1345 / Raw
Ether / IP / UDP 10.2.2.9:62755 > 10.2.2.255:netbios_ns / NBNSQueryRequest
Ether / ARP who has 10.2.2.254 says 10.2.2.7 / Padding
Ether / ARP who has 10.2.2.254 says 10.2.2.16 / Padding
Ether / ARP who has 10.2.201.17 says 10.2.203.254 / Padding
Ether / IPv6 / UDP fe80::204a:76c7:f703:c7c5:dhcpv6_client > ff02::1:2:dhcpv6_server / DHCP6_Solicit / DHCP6OptElapsedTime / DHCP6OptClientId / DHCP6OptIA_NA / DHCP6OptClientFQDN / DHCP6OptVendorClass / DHCP6OptOptReq
Ether / ARP who has 169.254.134.66 says 169.254.134.66 / Padding
Ether / ARP who has 10.2.203.254 says 10.2.201.160 / Padding
Ether / IP / UDP 10.2.0.249:netbios_ns > 10.2.0.255:netbios_ns / NBNSQueryRequest
Ether / ARP is at 1c:b0:94:c9:0b:58 says 10.2.203.4 / Padding
Ether / ARP who has 10.2.203.254 says 10.2.200.81 / Padding
Ether / ARP who has 10.2.7.205 says 10.2.7.254 / Padding
Ether / IP / UDP 10.2.0.249:netbios_ns > 10.2.0.255:netbios_ns / NBNSQueryRequest
Ether / ARP who has 169.254.134.66 says 0.0.0.0 / Padding
Ether / IP / UDP 10.2.2.11:57900 > 10.2.2.255:netbios_ns / NBNSQueryRequest
Ether / ARP who has 10.2.0.205 says 10.2.0.254 / Padding
Ether / IP / UDP 0.0.0.0:bootpc > 255.255.255.255:bootps / BOOTP / DHCP
Ether / IP / UDP 10.2.0.249:netbios_ns > 10.2.0.255:netbios_ns / NBNSQueryRequest
Ether / ARP who has 10.2.2.254 says 10.2.2.13 / Padding
Ether / IP / UDP 10.2.200.60:61640 > 10.2.203.255:32414 / Raw
Ether / IP / UDP 10.2.200.60:61643 > 10.2.203.255:32412 / Raw
Ether / IP / UDP 10.2.2.4:61910 > 10.2.2.255:netbios_ns / NBNSQueryRequest
Ether / ARP who has 169.254.134.66 says 0.0.0.0 / Padding
Ether / ARP who has 10.2.2.254 says 10.2.2.1 / Padding
Ether / ARP who has 169.254.134.66 says 0.0.0.0 / Padding
Ether / IP / UDP 10.2.2.6:1346 > 229.55.150.208:1345 / Raw
Ether / IP / UDP 10.2.2.6:53288 > 10.2.2.255:netbios_ns / NBNSQueryRequest
Ether / IP / UDP 0.0.0.0:bootpc > 255.255.255.255:bootps / BOOTP / DHCP
Ether / IP / UDP 10.2.2.7:51383 > 10.2.2.255:netbios_ns / NBNSQueryRequest
Ether / ARP who has 10.2.203.254 says 10.2.201.95 / Padding
Ether / IPv6 / UDP fe80::204a:76c7:f703:c7c5:dhcpv6_client > ff02::1:2:dhcpv6_server / DHCP6_Solicit / DHCP6OptElapsedTime / DHCP6OptClientId / DHCP6OptIA_NA / DHCP6OptClientFQDN / DHCP6OptVendorClass / DHCP6OptOptReq
Ether / ARP who has 10.2.2.254 says 10.2.2.8 / Padding
Ether / ARP who has 10.2.2.254 says 10.2.2.4 / Padding
Ether / ARP who has 10.2.0.205 says 10.2.0.254 / Padding
Ether / IP / UDP 10.2.2.18:1346 > 229.55.150.208:1345 / Raw
Ether / IP / UDP 10.2.2.18:54348 > 10.2.2.255:netbios_ns / NBNSQueryRequest
Ether / ARP who has 10.2.7.254 says 10.2.7.16 / Padding
Ether / IP / UDP 10.2.2.9:62755 > 10.2.2.255:netbios_ns / NBNSQueryRequest
Ether / ARP who has 10.2.2.254 says 10.2.2.5 / Padding
Ether / ARP who has 10.2.201.247 says 10.2.203.254 / Padding
Ether / ARP who has 10.2.203.254 says 10.2.201.95 / Padding
Ether / IPv6 / UDP fe80::65b8:cda7:3c70:e030:dhcpv6_client > ff02::1:2:dhcpv6_server / DHCP6_Solicit / DHCP6OptElapsedTime / DHCP6OptClientId / DHCP6OptIA_NA / DHCP6OptClientFQDN / DHCP6OptVendorClass / DHCP6OptOptReq
Ether / ARP who has 169.254.134.66 says 169.254.134.66 / Padding
Ether / IP / UDP 10.2.5.3:netbios_ns > 10.2.5.255:netbios_ns / NBNSQueryRequest
Ether / IP / UDP 10.2.5.18:netbios_dgm > 10.2.5.255:netbios_dgm / NBTDatagram / Raw
Ether / IP / UDP 10.2.5.22:netbios_ns > 10.2.5.255:netbios_ns / NBNSQueryRequest
Ether / IP / UDP 10.2.1.15:netbios_dgm > 10.2.1.255:netbios_dgm / NBTDatagram / Raw
Ether / IP / UDP 10.2.2.17:1346 > 229.55.150.208:1345 / Raw
Ether / IP / UDP 10.2.2.17:56840 > 10.2.2.255:netbios_ns / NBNSQueryRequest
Ether / ARP who has 10.2.2.254 says 10.2.2.18 / Padding
Ether / IP / UDP 10.2.2.11:1346 > 229.55.150.208:1345 / Raw
Ether / IP / UDP 10.2.2.11:57901 > 10.2.2.255:netbios_ns / NBNSQueryRequest
Ether / IP / UDP 10.2.2.3:netbios_dgm > 10.2.2.255:netbios_dgm / NBTDatagram / Raw
Ether / ARP who has 10.2.1.250 says 10.2.1.13 / Padding
Ether / ARP who has 10.2.201.95 says 10.2.201.95 / Padding
Ether / IP / UDP 10.2.202.243:bootpc > 10.0.0.253:bootps / BOOTP / DHCP
Ether / ARP who has 10.2.201.193 says 10.2.203.254 / Padding
Ether / ARP who has 10.2.2.254 says 10.2.2.15 / Padding
Ether / IP / UDP 10.2.200.60:61640 > 10.2.203.255:32414 / Raw
Ether / IP / UDP 10.2.200.60:61643 > 10.2.203.255:32412 / Raw
Ether / ARP who has 10.2.1.250 says 10.2.1.13 / Padding
Ether / IP / UDP 10.2.2.4:61910 > 10.2.2.255:netbios_ns / NBNSQueryRequest
Ether / ARP who has 10.2.2.254 says 10.2.2.12 / Padding
Ether / ARP who has 10.2.2.254 says 10.2.2.9 / Padding
Ether / ARP who has 10.2.1.250 says 10.2.1.13 / Padding
Ether / ARP who has 10.2.0.187 says 10.2.0.187 / Padding
Ether / IP / UDP 10.2.2.6:53288 > 10.2.2.255:netbios_ns / NBNSQueryRequest
Ether / ARP who has 10.2.6.20 says 10.2.6.254 / Padding
Ether / ARP who has 10.2.1.230 says 10.2.1.254 / Padding
Ether / IP / UDP 10.2.2.7:1346 > 229.55.150.208:1345 / Raw
Ether / ARP who has 10.2.3.230 says 10.2.3.254 / Padding
Ether / IP / UDP 10.2.2.7:51384 > 10.2.2.255:netbios_ns / NBNSQueryRequest
Ether / IP / UDP 10.2.0.249:netbios_ns > 10.2.0.255:netbios_ns / NBNSQueryRequest
Ether / IP / UDP 10.2.2.18:54348 > 10.2.2.255:netbios_ns / NBNSQueryRequest
Ether / IP / UDP 10.2.2.9:62756 > 10.2.2.255:netbios_ns / NBNSQueryRequest
Ether / IP / TCP 54.192.83.33:https > 10.2.201.155:53762 A / Raw
Ether / IP / TCP 54.192.83.33:https > 10.2.201.155:53762 A / Raw
Ether / IP / TCP 54.192.83.33:https > 10.2.201.155:53762 A / Raw
Ether / IP / TCP 54.192.83.33:https > 10.2.201.155:53762 A / Raw
Ether / IP / TCP 54.192.83.33:https > 10.2.201.155:53762 A / Raw
Ether / IP / TCP 54.192.83.33:https > 10.2.201.155:53762 A / Raw
Ether / IP / TCP 54.192.83.33:https > 10.2.201.155:53762 A / Raw
Ether / IP / TCP 54.192.83.33:https > 10.2.201.155:53762 A / Raw
Ether / IP / TCP 54.192.83.33:https > 10.2.201.155:53762 A / Raw
Ether / IP / TCP 54.192.83.33:https > 10.2.201.155:53762 A / Raw
Ether / IP / TCP 54.192.83.33:https > 10.2.201.155:53762 A / Raw
Ether / IP / TCP 54.192.83.33:https > 10.2.201.155:53762 A / Raw
Ether / IP / UDP 10.2.0.249:netbios_ns > 10.2.0.255:netbios_ns / NBNSQueryRequest
Ether / IP / UDP 10.2.0.2:netbios_dgm > 10.2.0.255:netbios_dgm / NBTDatagram / Raw
Ether / IP / TCP 54.192.83.33:https > 10.2.201.155:53762 A / Raw
Ether / IP / TCP 54.192.83.33:https > 10.2.201.155:53762 A / Raw
Ether / IP / TCP 54.192.83.33:https > 10.2.201.155:53762 A / Raw
Ether / IP / TCP 54.192.83.33:https > 10.2.201.155:53762 A / Raw
Ether / IP / TCP 54.192.83.33:https > 10.2.201.155:53762 A / Raw
Ether / IP / TCP 54.192.83.33:https > 10.2.201.155:53762 A / Raw
Ether / IP / TCP 54.192.83.33:https > 10.2.201.155:53762 A / Raw
Ether / IP / TCP 54.192.83.33:https > 10.2.201.155:53762 A / Raw
Ether / IP / TCP 54.192.83.33:https > 10.2.201.155:53762 A / Raw
Ether / IP / TCP 54.192.83.33:https > 10.2.201.155:53762 A / Raw
Ether / IP / TCP 54.192.83.33:https > 10.2.201.155:53762 A / Raw
Ether / ARP who has 10.2.2.254 says 10.2.2.7 / Padding
Ether / IP / TCP 54.192.83.33:https > 10.2.201.155:53762 A / Raw
Ether / IP / TCP 54.192.83.33:https > 10.2.201.155:53762 A / Raw
Ether / IP / TCP 54.192.83.33:https > 10.2.201.155:53762 A / Raw
Ether / IP / TCP 54.192.83.33:https > 10.2.201.155:53762 A / Raw
Ether / IP / TCP 54.192.83.33:https > 10.2.201.155:53762 A / Raw
Ether / IP / TCP 54.192.83.33:https > 10.2.201.155:53762 A / Raw
Ether / IP / TCP 54.192.83.33:https > 10.2.201.155:53762 A / Raw
Ether / IP / TCP 54.192.83.33:https > 10.2.201.155:53762 A / Raw
Ether / IP / TCP 54.192.83.33:https > 10.2.201.155:53762 A / Raw
Ether / ARP who has 10.2.2.254 says 10.2.2.16 / Padding
Ether / IP / TCP 54.192.83.33:https > 10.2.201.155:53762 A / Raw
Ether / IP / TCP 54.192.83.33:https > 10.2.201.155:53762 A / Raw
Ether / IP / TCP 54.192.83.33:https > 10.2.201.155:53762 A / Raw
Ether / IP / TCP 54.192.83.33:https > 10.2.201.155:53762 A / Raw
Ether / IP / TCP 54.192.83.33:https > 10.2.201.155:53762 A / Raw
Ether / IP / TCP 64.233.186.104:https > 10.2.201.155:53776 PA / Raw
Ether / IP / TCP 64.233.186.104:https > 10.2.201.155:53776 PA / Raw
Ether / IP / TCP 64.233.186.104:https > 10.2.201.155:53776 PA / Raw
Ether / IP / TCP 54.192.83.33:https > 10.2.201.155:53762 A / Raw
Ether / IP / TCP 54.192.83.33:https > 10.2.201.155:53762 A / Raw
Ether / IP / TCP 54.192.83.33:https > 10.2.201.155:53762 A / Raw
Ether / IP / TCP 54.192.83.33:https > 10.2.201.155:53762 A / Raw
Ether / IPv6 / ICMPv6ND_RS / ICMPv6 Neighbor Discovery Option - Source Link-Layer Address f8:cf:c5:44:9c:8e
Ether / ARP who has 10.2.203.254 says 10.2.201.160 / Padding
Ether / IP / TCP 54.192.83.33:https > 10.2.201.155:53762 A / Raw
Ether / IP / TCP 54.192.83.33:https > 10.2.201.155:53762 A / Raw
Ether / IP / TCP 54.192.83.33:https > 10.2.201.155:53762 A / Raw
Ether / IP / TCP 54.192.83.33:https > 10.2.201.155:53762 A / Raw
Ether / IP / TCP 54.192.83.33:https > 10.2.201.155:53762 A / Raw
Ether / IP / TCP 54.192.83.33:https > 10.2.201.155:53762 A / Raw
Ether / IP / TCP 54.192.83.33:https > 10.2.201.155:53762 A / Raw
Ether / IP / TCP 54.192.83.33:https > 10.2.201.155:53762 A / Raw
Ether / IP / TCP 54.192.83.33:https > 10.2.201.155:53762 A / Raw
Ether / IP / TCP 54.192.83.33:https > 10.2.201.155:53762 A / Raw
Ether / IP / TCP 54.192.83.33:https > 10.2.201.155:53762 A / Raw
Ether / IP / TCP 54.192.83.33:https > 10.2.201.155:53762 A / Raw
Ether / IP / TCP 54.192.83.33:https > 10.2.201.155:53762 A / Raw
Ether / IP / TCP 54.192.83.33:https > 10.2.201.155:53762 A / Raw
Ether / IP / TCP 54.192.83.33:https > 10.2.201.155:53762 A / Raw
Ether / IP / TCP 54.192.83.33:https > 10.2.201.155:53762 A / Raw
Ether / IP / TCP 54.192.83.33:https > 10.2.201.155:53762 A / Raw
Ether / IP / TCP 54.192.83.33:https > 10.2.201.155:53762 A / Raw
Ether / IP / TCP 54.192.83.33:https > 10.2.201.155:53762 A / Raw
Ether / IP / TCP 54.192.83.33:https > 10.2.201.155:53762 A / Raw
Ether / IP / TCP 54.192.83.33:https > 10.2.201.155:53762 A / Raw
Ether / IP / TCP 54.192.83.33:https > 10.2.201.155:53762 A / Raw
Ether / IP / TCP 54.192.83.33:https > 10.2.201.155:53762 A / Raw
Ether / IP / TCP 54.192.83.33:https > 10.2.201.155:53762 A / Raw
Ether / IP / TCP 54.192.83.33:https > 10.2.201.155:53762 A / Raw
Ether / IP / TCP 54.192.83.33:https > 10.2.201.155:53762 A / Raw
Ether / IP / TCP 54.192.83.33:https > 10.2.201.155:53762 A / Raw
Ether / IP / TCP 54.192.83.33:https > 10.2.201.155:53762 A / Raw
Ether / IP / TCP 54.192.83.33:https > 10.2.201.155:53762 A / Raw
Ether / IP / TCP 54.192.83.33:https > 10.2.201.155:53762 A / Raw
Ether / IP / TCP 54.192.83.33:https > 10.2.201.155:53762 A / Raw
Ether / IP / TCP 54.192.83.33:https > 10.2.201.155:53762 A / Raw
Ether / IP / TCP 54.192.83.33:https > 10.2.201.155:53762 A / Raw
Ether / IP / TCP 54.192.83.33:https > 10.2.201.155:53762 A / Raw
Ether / IP / TCP 54.192.83.33:https > 10.2.201.155:53762 A / Raw
Ether / IP / TCP 54.192.83.33:https > 10.2.201.155:53762 A / Raw
Ether / IP / TCP 54.192.83.33:https > 10.2.201.155:53762 A / Raw
Ether / IP / TCP 54.192.83.33:https > 10.2.201.155:53762 A / Raw
Ether / IP / TCP 54.192.83.33:https > 10.2.201.155:53762 A / Raw
Ether / IP / TCP 54.192.83.33:https > 10.2.201.155:53762 A / Raw
Ether / IP / TCP 54.192.83.33:https > 10.2.201.155:53762 A / Raw
Ether / IP / TCP 54.192.83.33:https > 10.2.201.155:53762 A / Raw
Ether / IP / TCP 54.192.83.33:https > 10.2.201.155:53762 A / Raw
Ether / IP / TCP 54.192.83.33:https > 10.2.201.155:53762 A / Raw
Ether / IP / TCP 54.192.83.33:https > 10.2.201.155:53762 A / Raw
Ether / IP / TCP 54.192.83.33:https > 10.2.201.155:53762 A / Raw
Ether / IP / TCP 172.217.29.14:https > 10.2.200.60:50878 A
Ether / IP / TCP 54.192.83.33:https > 10.2.201.155:53762 A / Raw
Ether / IP / TCP 54.192.83.33:https > 10.2.201.155:53762 A / Raw
Ether / IP / TCP 54.192.83.33:https > 10.2.201.155:53762 A / Raw
Ether / IP / TCP 54.192.83.33:https > 10.2.201.155:53762 A / Raw
Ether / IP / TCP 54.192.83.33:https > 10.2.201.155:53762 A / Raw
Ether / IP / TCP 54.192.83.33:https > 10.2.201.155:53762 A / Raw
Ether / IP / TCP 54.192.83.33:https > 10.2.201.155:53762 A / Raw
Ether / IP / TCP 54.192.83.33:https > 10.2.201.155:53762 A / Raw
Ether / IP / TCP 54.192.83.33:https > 10.2.201.155:53762 A / Raw
Ether / IP / TCP 54.192.83.33:https > 10.2.201.155:53762 A / Raw
Ether / IP / TCP 54.192.83.33:https > 10.2.201.155:53762 A / Raw
Ether / IP / TCP 54.192.83.33:https > 10.2.201.155:53762 A / Raw
Ether / IP / TCP 54.192.83.33:https > 10.2.201.155:53762 A / Raw
Ether / IP / TCP 54.192.83.33:https > 10.2.201.155:53762 A / Raw
Ether / IP / TCP 54.192.83.33:https > 10.2.201.155:53762 A / Raw
Ether / IP / TCP 54.192.83.33:https > 10.2.201.155:53762 A / Raw
Ether / IP / TCP 54.192.83.33:https > 10.2.201.155:53762 A / Raw
Ether / IP / TCP 54.192.83.33:https > 10.2.201.155:53762 A / Raw
Ether / IP / TCP 54.192.83.33:https > 10.2.201.155:53762 A / Raw
Ether / IP / TCP 54.192.83.33:https > 10.2.201.155:53762 A / Raw
Ether / IP / TCP 54.192.83.33:https > 10.2.201.155:53762 A / Raw
Ether / IP / TCP 54.192.83.33:https > 10.2.201.155:53762 A / Raw
Ether / IP / TCP 54.192.83.33:https > 10.2.201.155:53762 A / Raw
Ether / IP / TCP 54.192.83.33:https > 10.2.201.155:53762 A / Raw
Ether / IP / TCP 54.192.83.33:https > 10.2.201.155:53762 A / Raw
Ether / IP / TCP 54.192.83.33:https > 10.2.201.155:53762 A / Raw
Ether / IP / TCP 54.192.83.33:https > 10.2.201.155:53762 A / Raw
Ether / IP / TCP 54.192.83.33:https > 10.2.201.155:53762 A / Raw
Ether / IP / TCP 54.192.83.33:https > 10.2.201.155:53762 A / Raw
Ether / IP / TCP 54.192.83.33:https > 10.2.201.155:53762 A / Raw
Ether / IP / TCP 54.192.83.33:https > 10.2.201.155:53762 A / Raw
Ether / IP / TCP 54.192.83.33:https > 10.2.201.155:53762 A / Raw
Ether / IP / TCP 64.233.186.104:https > 10.2.201.155:53776 PA / Raw
Ether / IP / TCP 64.233.186.125:xmpp_client > 10.2.201.155:53717 A
Ether / IP / TCP 54.192.83.33:https > 10.2.201.155:53762 A / Raw
Ether / IP / TCP 64.233.186.104:https > 10.2.201.155:53776 PA / Raw
Ether / IP / TCP 64.233.186.125:xmpp_client > 10.2.201.155:53717 A
Ether / IP / TCP 54.192.83.33:https > 10.2.201.155:53762 A / Raw
Ether / IP / TCP 54.192.83.33:https > 10.2.201.155:53762 A / Raw
Ether / IP / TCP 54.192.83.33:https > 10.2.201.155:53762 A / Raw
Ether / IP / TCP 157.92.32.83:http_alt > 10.2.203.101:54551 A / Padding
Ether / IP / TCP 157.92.32.83:http_alt > 10.2.203.101:54551 A / Padding
Ether / IP / TCP 54.192.83.33:https > 10.2.201.155:53762 A / Raw
Ether / IP / TCP 54.192.83.33:https > 10.2.201.155:53762 A / Raw
Ether / IP / TCP 54.192.83.33:https > 10.2.201.155:53762 A / Raw
Ether / IP / TCP 54.192.83.33:https > 10.2.201.155:53762 A / Raw
Ether / IP / TCP 54.192.83.33:https > 10.2.201.155:53762 A / Raw
Ether / IP / TCP 54.192.83.33:https > 10.2.201.155:53762 A / Raw
Ether / IP / TCP 54.192.83.33:https > 10.2.201.155:53762 A / Raw
Ether / IP / TCP 54.192.83.33:https > 10.2.201.155:53762 A / Raw
Ether / IP / TCP 54.192.83.33:https > 10.2.201.155:53762 A / Raw
Ether / IP / TCP 54.192.83.33:https > 10.2.201.155:53762 A / Raw
Ether / IP / TCP 54.192.83.33:https > 10.2.201.155:53762 A / Raw
Ether / IP / TCP 54.192.83.33:https > 10.2.201.155:53762 A / Raw
Ether / IP / TCP 54.192.83.33:https > 10.2.201.155:53762 A / Raw
Ether / IP / TCP 54.192.83.33:https > 10.2.201.155:53762 A / Raw
Ether / IP / TCP 54.192.83.33:https > 10.2.201.155:53762 A / Raw
Ether / IP / TCP 54.192.83.33:https > 10.2.201.155:53762 A / Raw
Ether / IP / TCP 54.192.83.33:https > 10.2.201.155:53762 A / Raw
Ether / IP / TCP 54.192.83.33:https > 10.2.201.155:53762 A / Raw
Ether / IP / TCP 54.192.83.33:https > 10.2.201.155:53762 A / Raw
Ether / IP / TCP 54.192.83.33:https > 10.2.201.155:53762 A / Raw
Ether / IP / TCP 54.192.83.33:https > 10.2.201.155:53762 A / Raw
Ether / IP / TCP 54.192.83.33:https > 10.2.201.155:53762 A / Raw
Ether / IP / TCP 54.192.83.33:https > 10.2.201.155:53762 A / Raw
Ether / IP / TCP 54.192.83.33:https > 10.2.201.155:53762 A / Raw
Ether / IP / TCP 54.192.83.33:https > 10.2.201.155:53762 A / Raw
Ether / IP / TCP 54.192.83.33:https > 10.2.201.155:53762 A / Raw
Ether / IP / TCP 54.192.83.33:https > 10.2.201.155:53762 A / Raw
Ether / IP / TCP 54.192.83.33:https > 10.2.201.155:53762 A / Raw
Ether / IP / TCP 54.192.83.33:https > 10.2.201.155:53762 A / Raw
Ether / IP / TCP 54.192.83.33:https > 10.2.201.155:53762 A / Raw
Ether / IP / TCP 54.192.83.33:https > 10.2.201.155:53762 A / Raw
Ether / IP / TCP 54.192.83.33:https > 10.2.201.155:53762 A / Raw
Ether / IP / TCP 54.192.83.33:https > 10.2.201.155:53762 A / Raw
Ether / IP / TCP 54.192.83.33:https > 10.2.201.155:53762 A / Raw
Ether / IP / TCP 54.192.83.33:https > 10.2.201.155:53762 A / Raw
Ether / IP / TCP 54.192.83.33:https > 10.2.201.155:53762 A / Raw
Ether / IP / TCP 54.192.83.33:https > 10.2.201.155:53762 A / Raw
Ether / IP / TCP 54.192.83.33:https > 10.2.201.155:53762 A / Raw
Ether / IP / TCP 54.192.83.33:https > 10.2.201.155:53762 A / Raw
Ether / IP / TCP 54.192.83.33:https > 10.2.201.155:53762 A / Raw
Ether / IP / TCP 54.192.83.33:https > 10.2.201.155:53762 A / Raw
Ether / IP / TCP 54.192.83.33:https > 10.2.201.155:53762 A / Raw
Ether / IP / TCP 54.192.83.33:https > 10.2.201.155:53762 A / Raw
Ether / IP / TCP 54.192.83.33:https > 10.2.201.155:53762 A / Raw
Ether / IP / TCP 54.192.83.33:https > 10.2.201.155:53762 A / Raw
Ether / IP / TCP 54.192.83.33:https > 10.2.201.155:53762 A / Raw
Ether / IP / TCP 54.192.83.33:https > 10.2.201.155:53762 A / Raw
Ether / IP / TCP 54.192.83.33:https > 10.2.201.155:53762 A / Raw
Ether / IP / TCP 54.192.83.33:https > 10.2.201.155:53762 A / Raw
Ether / IP / TCP 54.192.83.33:https > 10.2.201.155:53762 A / Raw
Ether / IP / TCP 54.192.83.33:https > 10.2.201.155:53762 A / Raw
Ether / IP / TCP 54.192.83.33:https > 10.2.201.155:53762 A / Raw
Ether / IP / TCP 54.192.83.33:https > 10.2.201.155:53762 A / Raw
Ether / IP / TCP 54.192.83.33:https > 10.2.201.155:53762 A / Raw
Ether / IP / TCP 54.192.83.33:https > 10.2.201.155:53762 A / Raw
Ether / IP / TCP 54.192.83.33:https > 10.2.201.155:53762 A / Raw
Ether / IP / TCP 54.192.83.33:https > 10.2.201.155:53762 A / Raw
Ether / IP / TCP 54.192.83.33:https > 10.2.201.155:53762 A / Raw
Ether / IP / TCP 54.192.83.33:https > 10.2.201.155:53762 A / Raw
Ether / IP / TCP 54.192.83.33:https > 10.2.201.155:53762 A / Raw
Ether / IP / TCP 54.192.83.33:https > 10.2.201.155:53762 A / Raw
Ether / IP / TCP 54.192.83.33:https > 10.2.201.155:53762 A / Raw
Ether / IP / TCP 54.192.83.33:https > 10.2.201.155:53762 A / Raw
Ether / IP / TCP 54.192.83.33:https > 10.2.201.155:53762 A / Raw
Ether / IP / TCP 54.192.83.33:https > 10.2.201.155:53762 A / Raw
Ether / IP / TCP 54.192.83.33:https > 10.2.201.155:53762 A / Raw
Ether / IP / TCP 54.192.83.33:https > 10.2.201.155:53762 A / Raw
Ether / IP / TCP 54.192.83.33:https > 10.2.201.155:53762 A / Raw
Ether / IP / TCP 54.192.83.33:https > 10.2.201.155:53762 A / Raw
Ether / IP / TCP 54.192.83.33:https > 10.2.201.155:53762 A / Raw
Ether / IP / TCP 54.192.83.33:https > 10.2.201.155:53762 A / Raw
Ether / IP / TCP 54.192.83.33:https > 10.2.201.155:53762 A / Raw
Ether / IP / TCP 54.192.83.33:https > 10.2.201.155:53762 A / Raw
Ether / IP / TCP 54.192.83.33:https > 10.2.201.155:53762 A / Raw
Ether / IP / TCP 54.192.83.33:https > 10.2.201.155:53762 A / Raw
Ether / IP / TCP 54.192.83.33:https > 10.2.201.155:53762 A / Raw
Ether / IP / TCP 54.192.83.33:https > 10.2.201.155:53762 A / Raw
Ether / IP / TCP 54.192.83.33:https > 10.2.201.155:53762 A / Raw
Ether / IP / TCP 54.192.83.33:https > 10.2.201.155:53762 A / Raw
Ether / IP / TCP 54.192.83.33:https > 10.2.201.155:53762 A / Raw
Ether / IP / TCP 157.92.32.84:http_alt > 10.2.203.101:54789 PA / Raw
Ether / IP / TCP 54.192.83.33:https > 10.2.201.155:53762 A / Raw
Ether / IP / TCP 54.192.83.33:https > 10.2.201.155:53762 A / Raw
Ether / IP / TCP 54.192.83.33:https > 10.2.201.155:53762 A / Raw
Ether / IP / TCP 54.192.83.33:https > 10.2.201.155:53762 A / Raw
Ether / IP / TCP 54.192.83.33:https > 10.2.201.155:53762 A / Raw
Ether / IP / TCP 54.192.83.33:https > 10.2.201.155:53762 A / Raw
Ether / IP / TCP 54.192.83.33:https > 10.2.201.155:53762 A / Raw
Ether / IP / TCP 54.192.83.33:https > 10.2.201.155:53762 A / Raw
Ether / IP / TCP 54.192.83.33:https > 10.2.201.155:53762 A / Raw
Ether / IP / TCP 54.192.83.33:https > 10.2.201.155:53762 A / Raw
Ether / IP / TCP 54.192.83.33:https > 10.2.201.155:53762 A / Raw
Ether / IP / TCP 54.192.83.33:https > 10.2.201.155:53762 A / Raw
Ether / IP / TCP 54.192.83.33:https > 10.2.201.155:53762 A / Raw
Ether / IP / TCP 54.192.83.33:https > 10.2.201.155:53762 A / Raw
Ether / IP / TCP 54.192.83.33:https > 10.2.201.155:53762 A / Raw
Ether / IP / TCP 54.192.83.33:https > 10.2.201.155:53762 A / Raw
Ether / IP / TCP 54.192.83.33:https > 10.2.201.155:53762 A / Raw
Ether / IP / TCP 54.192.83.33:https > 10.2.201.155:53762 A / Raw
Ether / IP / TCP 54.192.83.33:https > 10.2.201.155:53762 A / Raw
Ether / IP / TCP 54.192.83.33:https > 10.2.201.155:53762 A / Raw
Ether / IP / TCP 54.192.83.33:https > 10.2.201.155:53762 A / Raw
Ether / IP / TCP 54.192.83.33:https > 10.2.201.155:53762 A / Raw
Ether / IP / TCP 54.192.83.33:https > 10.2.201.155:53762 A / Raw
Ether / IP / TCP 54.192.83.33:https > 10.2.201.155:53762 A / Raw
Ether / IP / TCP 54.192.83.33:https > 10.2.201.155:53762 A / Raw
Ether / IP / TCP 54.192.83.33:https > 10.2.201.155:53762 A / Raw
Ether / IP / TCP 54.192.83.33:https > 10.2.201.155:53762 A / Raw
Ether / IP / TCP 54.192.83.33:https > 10.2.201.155:53762 A / Raw
Ether / IP / TCP 54.192.83.33:https > 10.2.201.155:53762 A / Raw
Ether / IP / TCP 54.192.83.33:https > 10.2.201.155:53762 A / Raw
Ether / IP / TCP 54.192.83.33:https > 10.2.201.155:53762 A / Raw
Ether / IP / TCP 54.192.83.33:https > 10.2.201.155:53762 A / Raw
Ether / IP / TCP 157.92.32.84:http_alt > 10.2.203.101:54796 PA / Raw
Ether / IP / TCP 157.92.32.84:http_alt > 10.2.203.101:54796 A / Raw
Ether / IP / TCP 157.92.32.84:http_alt > 10.2.203.101:54796 A / Raw
Ether / IP / TCP 157.92.32.84:http_alt > 10.2.203.101:54796 A / Raw
Ether / IP / TCP 157.92.32.84:http_alt > 10.2.203.101:54796 A / Raw
Ether / IP / TCP 157.92.32.84:http_alt > 10.2.203.101:54796 A / Raw
Ether / IP / TCP 157.92.32.84:http_alt > 10.2.203.101:54796 A / Raw
Ether / IP / TCP 157.92.32.84:http_alt > 10.2.203.101:54796 A / Raw
Ether / IP / TCP 157.92.32.84:http_alt > 10.2.203.101:54796 PA / Raw
Ether / IP / TCP 157.92.32.84:http_alt > 10.2.203.101:54796 PA / Raw
Ether / IP / TCP 157.92.32.84:http_alt > 10.2.203.101:54789 PA / Raw
Ether / IP / TCP 64.233.186.94:https > 10.2.202.169:52402 A
Ether / IP / TCP 54.192.83.33:https > 10.2.201.155:53762 A / Raw
Ether / IP / TCP 54.192.83.33:https > 10.2.201.155:53762 A / Raw
Ether / IP / TCP 54.192.83.33:https > 10.2.201.155:53762 A / Raw
Ether / IP / TCP 54.192.83.33:https > 10.2.201.155:53762 A / Raw
Ether / IP / TCP 157.92.32.84:http_alt > 10.2.203.101:54796 A / Raw
Ether / IP / TCP 157.92.32.84:http_alt > 10.2.203.101:54796 PA / Raw
Ether / IP / TCP 54.192.83.33:https > 10.2.201.155:53762 A / Raw
Ether / IP / TCP 54.192.83.33:https > 10.2.201.155:53762 A / Raw
Ether / IP / TCP 54.192.83.33:https > 10.2.201.155:53762 A / Raw
Ether / IP / TCP 54.192.83.33:https > 10.2.201.155:53762 A / Raw
Ether / IP / TCP 54.192.83.33:https > 10.2.201.155:53762 A / Raw
Ether / IP / TCP 54.192.83.33:https > 10.2.201.155:53762 A / Raw
Ether / IP / TCP 54.192.83.33:https > 10.2.201.155:53762 A / Raw
Ether / IP / TCP 54.192.83.33:https > 10.2.201.155:53762 A / Raw
Ether / IP / TCP 54.192.83.33:https > 10.2.201.155:53762 A / Raw
Ether / IP / TCP 54.192.83.33:https > 10.2.201.155:53762 A / Raw
Ether / IP / TCP 54.192.83.33:https > 10.2.201.155:53762 A / Raw
Ether / IP / TCP 54.192.83.33:https > 10.2.201.155:53762 A / Raw
Ether / IP / TCP 54.192.83.33:https > 10.2.201.155:53762 A / Raw
Ether / IP / TCP 54.192.83.33:https > 10.2.201.155:53762 A / Raw
Ether / IP / TCP 54.192.83.33:https > 10.2.201.155:53762 A / Raw
Ether / IP / TCP 54.192.83.33:https > 10.2.201.155:53762 A / Raw
Ether / IP / TCP 54.192.83.33:https > 10.2.201.155:53762 A / Raw
Ether / IP / TCP 54.192.83.33:https > 10.2.201.155:53762 A / Raw
Ether / IP / TCP 54.192.83.33:https > 10.2.201.155:53762 A / Raw
Ether / IP / TCP 54.192.83.33:https > 10.2.201.155:53762 A / Raw
Ether / IP / TCP 54.192.83.33:https > 10.2.201.155:53762 A / Raw
Ether / IP / TCP 54.192.83.33:https > 10.2.201.155:53762 A / Raw
Ether / IP / TCP 54.192.83.33:https > 10.2.201.155:53762 A / Raw
Ether / IP / TCP 54.192.83.33:https > 10.2.201.155:53762 A / Raw
Ether / IP / TCP 54.192.83.33:https > 10.2.201.155:53762 A / Raw
Ether / IP / TCP 54.192.83.33:https > 10.2.201.155:53762 A / Raw
Ether / IP / TCP 54.192.83.33:https > 10.2.201.155:53762 A / Raw
Ether / IP / TCP 54.192.83.33:https > 10.2.201.155:53762 A / Raw
Ether / IP / TCP 54.192.83.33:https > 10.2.201.155:53762 A / Raw
Ether / IP / TCP 54.192.83.33:https > 10.2.201.155:53762 A / Raw
Ether / IP / TCP 54.192.83.33:https > 10.2.201.155:53762 A / Raw
Ether / IP / TCP 54.192.83.33:https > 10.2.201.155:53762 A / Raw
Ether / IP / TCP 54.192.83.33:https > 10.2.201.155:53762 A / Raw
Ether / IP / TCP 54.192.83.33:https > 10.2.201.155:53762 A / Raw
Ether / IP / TCP 54.192.83.33:https > 10.2.201.155:53762 A / Raw
Ether / IP / TCP 54.192.83.33:https > 10.2.201.155:53762 A / Raw
Ether / IP / TCP 54.192.83.33:https > 10.2.201.155:53762 A / Raw
Ether / IP / TCP 54.192.83.33:https > 10.2.201.155:53762 A / Raw
Ether / IP / TCP 54.192.83.33:https > 10.2.201.155:53762 A / Raw
Ether / IP / TCP 54.192.83.33:https > 10.2.201.155:53762 A / Raw
Ether / IP / TCP 54.192.83.33:https > 10.2.201.155:53762 A / Raw
Ether / IP / TCP 54.192.83.33:https > 10.2.201.155:53762 A / Raw
Ether / IP / TCP 54.192.83.33:https > 10.2.201.155:53762 A / Raw
Ether / IP / TCP 54.192.83.33:https > 10.2.201.155:53762 A / Raw
Ether / IP / TCP 54.192.83.33:https > 10.2.201.155:53762 A / Raw
Ether / IP / TCP 54.192.83.33:https > 10.2.201.155:53762 A / Raw
Ether / IP / TCP 54.192.83.33:https > 10.2.201.155:53762 A / Raw
Ether / IP / TCP 54.192.83.33:https > 10.2.201.155:53762 A / Raw
Ether / IP / TCP 54.192.83.33:https > 10.2.201.155:53762 A / Raw
Ether / IP / TCP 54.192.83.33:https > 10.2.201.155:53762 A / Raw
Ether / IP / TCP 54.192.83.33:https > 10.2.201.155:53762 A / Raw
Ether / IP / TCP 54.192.83.33:https > 10.2.201.155:53762 A / Raw
Ether / IP / TCP 54.192.83.33:https > 10.2.201.155:53762 A / Raw
Ether / IP / TCP 54.192.83.33:https > 10.2.201.155:53762 A / Raw
Ether / IP / TCP 54.192.83.33:https > 10.2.201.155:53762 A / Raw
Ether / IP / TCP 54.192.83.33:https > 10.2.201.155:53762 A / Raw
Ether / IP / TCP 54.192.83.33:https > 10.2.201.155:53762 A / Raw
Ether / IP / TCP 54.192.83.33:https > 10.2.201.155:53762 A / Raw
Ether / IP / TCP 54.192.83.33:https > 10.2.201.155:53762 A / Raw
Ether / IP / TCP 54.192.83.33:https > 10.2.201.155:53762 A / Raw
Ether / IP / TCP 54.192.83.33:https > 10.2.201.155:53762 A / Raw
Ether / IP / TCP 54.192.83.33:https > 10.2.201.155:53762 A / Raw
Ether / IP / TCP 54.192.83.33:https > 10.2.201.155:53762 A / Raw
Ether / IP / TCP 54.192.83.33:https > 10.2.201.155:53762 A / Raw
Ether / IP / TCP 54.192.83.33:https > 10.2.201.155:53762 A / Raw
Ether / IP / TCP 54.192.83.33:https > 10.2.201.155:53762 A / Raw
Ether / IP / TCP 54.192.83.33:https > 10.2.201.155:53762 A / Raw
Ether / IP / TCP 54.192.83.33:https > 10.2.201.155:53762 A / Raw
Ether / IP / TCP 54.192.83.33:https > 10.2.201.155:53762 A / Raw
Ether / IP / TCP 54.192.83.33:https > 10.2.201.155:53762 A / Raw
Ether / IP / TCP 54.192.83.33:https > 10.2.201.155:53762 A / Raw
Ether / IP / TCP 54.192.83.33:https > 10.2.201.155:53762 A / Raw
Ether / IP / TCP 54.192.83.33:https > 10.2.201.155:53762 A / Raw
Ether / IP / TCP 54.192.83.33:https > 10.2.201.155:53762 A / Raw
Ether / IP / TCP 54.192.83.33:https > 10.2.201.155:53762 A / Raw
Ether / IP / TCP 54.192.83.33:https > 10.2.201.155:53762 A / Raw
Ether / IP / TCP 54.192.83.33:https > 10.2.201.155:53762 A / Raw
Ether / IP / TCP 54.192.83.33:https > 10.2.201.155:53762 A / Raw
Ether / IP / TCP 54.192.83.33:https > 10.2.201.155:53762 A / Raw
Ether / IP / TCP 54.192.83.33:https > 10.2.201.155:53762 A / Raw
Ether / IP / TCP 54.192.83.33:https > 10.2.201.155:53762 A / Raw
Ether / IP / TCP 54.192.83.33:https > 10.2.201.155:53762 A / Raw
Ether / IP / TCP 54.192.83.33:https > 10.2.201.155:53762 A / Raw
Ether / IP / TCP 54.192.83.33:https > 10.2.201.155:53762 A / Raw
Ether / IP / TCP 54.192.83.33:https > 10.2.201.155:53762 A / Raw
Ether / IP / TCP 54.192.83.33:https > 10.2.201.155:53762 A / Raw
Ether / IP / TCP 54.192.83.33:https > 10.2.201.155:53762 A / Raw
Ether / IP / TCP 54.192.83.33:https > 10.2.201.155:53762 A / Raw
Ether / IP / TCP 54.192.83.33:https > 10.2.201.155:53762 A / Raw
Ether / IP / TCP 54.192.83.33:https > 10.2.201.155:53762 A / Raw
Ether / IP / TCP 54.192.83.33:https > 10.2.201.155:53762 A / Raw
Ether / IP / TCP 54.192.83.33:https > 10.2.201.155:53762 A / Raw
Ether / IP / TCP 54.192.83.33:https > 10.2.201.155:53762 A / Raw
Ether / IP / TCP 54.192.83.33:https > 10.2.201.155:53762 A / Raw
Ether / IP / TCP 54.192.83.33:https > 10.2.201.155:53762 A / Raw
Ether / IP / TCP 54.192.83.33:https > 10.2.201.155:53762 A / Raw
Ether / IP / TCP 54.192.83.33:https > 10.2.201.155:53762 A / Raw
Ether / IP / TCP 54.192.83.33:https > 10.2.201.155:53762 A / Raw
Ether / IP / TCP 54.192.83.33:https > 10.2.201.155:53762 A / Raw
Ether / IP / TCP 54.192.83.33:https > 10.2.201.155:53762 A / Raw
Ether / IP / TCP 54.192.83.33:https > 10.2.201.155:53762 A / Raw
Ether / IP / TCP 54.192.83.33:https > 10.2.201.155:53762 A / Raw
Ether / IP / TCP 54.192.83.33:https > 10.2.201.155:53762 A / Raw
Ether / IP / TCP 54.192.83.33:https > 10.2.201.155:53762 A / Raw
Ether / IP / TCP 54.192.83.33:https > 10.2.201.155:53762 A / Raw
Ether / IP / TCP 54.192.83.33:https > 10.2.201.155:53762 A / Raw
Ether / IP / TCP 54.192.83.33:https > 10.2.201.155:53762 A / Raw
Ether / IP / TCP 54.192.83.33:https > 10.2.201.155:53762 A / Raw
Ether / IP / TCP 54.192.83.33:https > 10.2.201.155:53762 A / Raw
Ether / IP / TCP 54.192.83.33:https > 10.2.201.155:53762 A / Raw
Ether / IP / TCP 54.192.83.33:https > 10.2.201.155:53762 A / Raw
Ether / IP / TCP 54.192.83.33:https > 10.2.201.155:53762 A / Raw
Ether / IP / TCP 54.192.83.33:https > 10.2.201.155:53762 A / Raw
Ether / IP / TCP 54.192.83.33:https > 10.2.201.155:53762 A / Raw
Ether / IP / TCP 54.192.83.33:https > 10.2.201.155:53762 A / Raw
Ether / IP / TCP 54.192.83.33:https > 10.2.201.155:53762 A / Raw
Ether / IP / TCP 54.192.83.33:https > 10.2.201.155:53762 A / Raw
Ether / IP / TCP 54.192.83.33:https > 10.2.201.155:53762 A / Raw
Ether / IP / TCP 54.192.83.33:https > 10.2.201.155:53762 A / Raw
Ether / IP / TCP 54.192.83.33:https > 10.2.201.155:53762 A / Raw
Ether / IP / TCP 54.192.83.33:https > 10.2.201.155:53762 A / Raw
Ether / IP / TCP 54.192.83.33:https > 10.2.201.155:53762 A / Raw
Ether / IP / TCP 54.192.83.33:https > 10.2.201.155:53762 A / Raw
Ether / IP / TCP 54.192.83.33:https > 10.2.201.155:53762 A / Raw
Ether / IP / TCP 54.192.83.33:https > 10.2.201.155:53762 A / Raw
Ether / IP / TCP 54.192.83.33:https > 10.2.201.155:53762 A / Raw
Ether / IP / TCP 54.192.83.33:https > 10.2.201.155:53762 A / Raw
Ether / IP / TCP 54.192.83.33:https > 10.2.201.155:53762 A / Raw
Ether / IP / TCP 54.192.83.33:https > 10.2.201.155:53762 A / Raw
Ether / IP / TCP 54.192.83.33:https > 10.2.201.155:53762 A / Raw
Ether / IP / TCP 54.192.83.33:https > 10.2.201.155:53762 A / Raw
Ether / IP / TCP 54.192.83.33:https > 10.2.201.155:53762 A / Raw
Ether / IP / TCP 54.192.83.33:https > 10.2.201.155:53762 A / Raw
Ether / IP / TCP 54.192.83.33:https > 10.2.201.155:53762 A / Raw
Ether / IP / TCP 54.192.83.33:https > 10.2.201.155:53762 A / Raw
Ether / IP / TCP 54.192.83.33:https > 10.2.201.155:53762 A / Raw
Ether / IP / TCP 54.192.83.33:https > 10.2.201.155:53762 A / Raw
Ether / IP / TCP 54.192.83.33:https > 10.2.201.155:53762 A / Raw
Ether / IP / TCP 54.192.83.33:https > 10.2.201.155:53762 A / Raw
Ether / IP / TCP 54.192.83.33:https > 10.2.201.155:53762 A / Raw
Ether / IP / TCP 54.192.83.33:https > 10.2.201.155:53762 A / Raw
Ether / IP / TCP 54.192.83.33:https > 10.2.201.155:53762 A / Raw
Ether / IP / TCP 54.192.83.33:https > 10.2.201.155:53762 A / Raw
Ether / IP / TCP 54.192.83.33:https > 10.2.201.155:53762 A / Raw
Ether / IP / TCP 54.192.83.33:https > 10.2.201.155:53762 A / Raw
Ether / IP / TCP 54.192.83.33:https > 10.2.201.155:53762 A / Raw
Ether / IP / TCP 54.192.83.33:https > 10.2.201.155:53762 A / Raw
Ether / IP / TCP 54.192.83.33:https > 10.2.201.155:53762 A / Raw
Ether / IP / TCP 54.192.83.33:https > 10.2.201.155:53762 A / Raw
Ether / IP / TCP 54.192.83.33:https > 10.2.201.155:53762 A / Raw
Ether / IP / TCP 54.192.83.33:https > 10.2.201.155:53762 A / Raw
Ether / IP / TCP 54.192.83.33:https > 10.2.201.155:53762 A / Raw
Ether / IP / TCP 54.192.83.33:https > 10.2.201.155:53762 A / Raw
Ether / IP / TCP 54.192.83.33:https > 10.2.201.155:53762 A / Raw
Ether / IP / TCP 54.192.83.33:https > 10.2.201.155:53762 A / Raw
Ether / IP / TCP 54.192.83.33:https > 10.2.201.155:53762 A / Raw
Ether / IP / TCP 54.192.83.33:https > 10.2.201.155:53762 A / Raw
Ether / IP / TCP 54.192.83.33:https > 10.2.201.155:53762 A / Raw
Ether / IP / TCP 54.192.83.33:https > 10.2.201.155:53762 A / Raw
Ether / IP / TCP 54.192.83.33:https > 10.2.201.155:53762 A / Raw
Ether / IP / TCP 54.192.83.33:https > 10.2.201.155:53762 A / Raw
Ether / IP / TCP 54.192.83.33:https > 10.2.201.155:53762 A / Raw
Ether / IP / TCP 54.192.83.33:https > 10.2.201.155:53762 A / Raw
Ether / IP / TCP 54.192.83.33:https > 10.2.201.155:53762 A / Raw
Ether / IP / TCP 54.192.83.33:https > 10.2.201.155:53762 A / Raw
Ether / IP / TCP 54.192.83.33:https > 10.2.201.155:53762 A / Raw
Ether / IP / TCP 54.192.83.33:https > 10.2.201.155:53762 A / Raw
