Ether / IP / TCP 173.252.120.6:https > 10.254.33.11:58094 PA / Raw
Ether / IP / TCP 173.252.120.6:https > 10.254.33.11:58094 PA / Raw
Ether / IP / TCP 31.13.73.7:https > 10.254.33.11:58110 PA / Raw
Ether / IP / TCP 31.13.73.7:https > 10.254.33.11:58110 PA / Raw
Ether / IP / TCP 31.13.73.7:https > 10.254.33.11:58110 PA / Raw
Ether / IP / TCP 173.252.120.6:https > 10.254.33.11:58094 A / Padding
Ether / IP / TCP 173.252.120.6:https > 10.254.33.11:58094 PA / Raw
Ether / IP / TCP 173.252.120.6:https > 10.254.33.11:58094 A / Padding
Ether / IP / TCP 173.252.120.6:https > 10.254.33.11:58094 PA / Raw
Ether / IP / TCP 173.252.120.6:https > 10.254.33.11:58094 A / Padding
Ether / IP / TCP 173.252.120.6:https > 10.254.33.11:58094 PA / Raw
Ether / IP / TCP 173.252.120.6:https > 10.254.33.11:58094 A / Padding
Ether / IP / TCP 173.252.120.6:https > 10.254.33.11:58094 PA / Raw
Ether / IP / TCP 173.252.120.6:https > 10.254.33.11:58094 A / Padding
Ether / IP / TCP 173.252.120.6:https > 10.254.33.11:58094 PA / Raw
Ether / IP / TCP 173.252.120.6:https > 10.254.33.11:58094 PA / Raw
Ether / IP / TCP 173.252.120.6:https > 10.254.33.11:58094 PA / Raw
Ether / IP / TCP 173.252.120.6:https > 10.254.33.11:58094 A / Padding
Ether / IP / TCP 173.252.120.6:https > 10.254.33.11:58094 PA / Raw
Ether / IP / TCP 173.252.120.6:https > 10.254.33.11:58094 PA / Raw
Ether / IP / TCP 173.252.120.6:https > 10.254.33.11:58094 PA / Raw
Ether / IP / TCP 173.252.120.6:https > 10.254.33.11:58094 PA / Raw
Ether / IP / TCP 173.252.120.6:https > 10.254.33.11:58094 PA / Raw
Ether / IP / TCP 173.252.120.6:https > 10.254.33.11:58094 PA / Raw
Ether / IP / TCP 52.35.249.34:https > 10.254.33.11:58105 PA / Raw
Ether / IP / TCP 173.252.120.6:https > 10.254.33.11:58094 PA / Raw
Ether / IP / TCP 52.35.249.34:https > 10.254.33.11:58105 PA / Raw
Ether / IP / TCP 173.252.120.6:https > 10.254.33.11:58094 PA / Raw
Ether / IP / TCP 52.35.249.34:https > 10.254.33.11:58105 PA / Raw
Ether / IP / TCP 173.252.120.6:https > 10.254.33.11:58094 PA / Raw
Ether / IP / TCP 52.35.249.34:https > 10.254.33.11:58105 PA / Raw
Ether / IP / TCP 173.252.120.6:https > 10.254.33.11:58094 PA / Raw
Ether / IP / TCP 52.35.249.34:https > 10.254.33.11:58105 PA / Raw
Ether / IP / TCP 173.252.120.6:https > 10.254.33.11:58094 PA / Raw
Ether / IP / TCP 52.35.249.34:https > 10.254.33.11:58105 PA / Raw
Ether / IP / TCP 173.252.120.6:https > 10.254.33.11:58094 PA / Raw
Ether / IP / TCP 52.35.249.34:https > 10.254.33.11:58105 PA / Raw
Ether / ARP is at 70:ca:9b:77:ac:7e says 10.254.33.1 / Padding
Ether / :: > ff02::16 (0) / IPv6ExtHdrHopByHop / Raw
Ether / IPv6 / ICMPv6 Neighbor Discovery - Neighbor Solicitation (tgt: fe80::a2e4:53ff:fecc:2d52)
Ether / IP / UDP 0.0.0.0:bootpc > 255.255.255.255:bootps / BOOTP / DHCP
Ether / IP / UDP 10.254.33.1:bootps > 255.255.255.255:bootpc / BOOTP / DHCP
Ether / IPv6 / ICMPv6ND_RS / ICMPv6 Neighbor Discovery Option - Source Link-Layer Address a0:e4:53:cc:2d:52
Ether / IP / UDP 0.0.0.0:bootpc > 255.255.255.255:bootps / BOOTP / DHCP
Ether / ARP who has 10.254.33.63 says 10.254.33.1 / Padding
Ether / IP / TCP 52.35.249.34:https > 10.254.33.11:58105 FA / Padding
Ether / IP / UDP / DNS Qry "syndication.twitter.com." 
Ether / IP / TCP 10.254.33.25:53676 > 199.16.156.241:https PA / Raw
Ether / IP / UDP / NTP v4, client
Ether / fe80::a2e4:53ff:fecc:2d52 > ff02::16 (0) / IPv6ExtHdrHopByHop / Raw
Ether / IP / TCP 10.254.33.25:53676 > 199.16.156.241:https PA / Raw
Ether / IP / UDP 0.0.0.0:bootpc > 255.255.255.255:bootps / BOOTP / DHCP
Ether / fe80::d8f5:7809:2d88:9800 > ff02::16 (0) / IPv6ExtHdrHopByHop / Raw
Ether / ARP who has 10.254.33.63 says 10.254.33.63 / Padding
Ether / IP / TCP 172.217.28.78:https > 10.254.33.11:58087 PA / Raw
Ether / IP / TCP 10.254.33.25:53676 > 199.16.156.241:https PA / Raw
Ether / fe80::d8f5:7809:2d88:9800 > ff02::16 (0) / IPv6ExtHdrHopByHop / Raw
Ether / IPv6 / UDP fe80::d8f5:7809:2d88:9800:57216 > ff02::1:3:hostmon / LLMNRQuery
Ether / IP / UDP 10.254.33.11:netbios_ns > 10.254.33.255:netbios_ns / NBNSQueryRequest
Ether / IPv6 / UDP fe80::d8f5:7809:2d88:9800:54606 > ff02::1:3:hostmon / LLMNRQuery
Ether / IP / UDP 10.254.33.11:54606 > 224.0.0.252:hostmon / LLMNRQuery
Ether / IPv6 / UDP fe80::d8f5:7809:2d88:9800:52672 > ff02::1:3:hostmon / LLMNRQuery
Ether / IP / UDP / NTP v4, client
Ether / IP / UDP 10.254.33.11:52672 > 224.0.0.252:hostmon / LLMNRQuery
Ether / IP / TCP 10.254.33.25:53676 > 199.16.156.241:https PA / Raw
Ether / fe80::d8f5:7809:2d88:9800 > ff02::16 (0) / IPv6ExtHdrHopByHop / Raw
Ether / IPv6 / UDP fe80::d8f5:7809:2d88:9800:57216 > ff02::1:3:hostmon / LLMNRQuery
Ether / IP / UDP 10.254.33.11:57216 > 224.0.0.252:hostmon / LLMNRQuery
Ether / IP / UDP / NTP v4, client
Ether / IP / UDP / NTP v4, client
Ether / ARP who has 10.254.33.1 says 10.254.33.63 / Padding
Ether / IPv6 / UDP fe80::d8f5:7809:2d88:9800:54606 > ff02::1:3:hostmon / LLMNRQuery
Ether / IP / UDP 10.254.33.11:54606 > 224.0.0.252:hostmon / LLMNRQuery
Ether / IPv6 / ICMPv6ND_RS / ICMPv6 Neighbor Discovery Option - Source Link-Layer Address a0:e4:53:cc:2d:52
Ether / IP / UDP / DNS Qry "syndication.twitter.com." 
Ether / IPv6 / UDP fe80::d8f5:7809:2d88:9800:52672 > ff02::1:3:hostmon / LLMNRQuery
Ether / IP / UDP 10.254.33.11:52672 > 224.0.0.252:hostmon / LLMNRQuery
Ether / IP / TCP 52.35.249.34:https > 10.254.33.11:58105 A / Padding
Ether / ARP who has 10.254.33.63 says 10.254.33.63 / Padding
Ether / IP / UDP 10.254.33.11:netbios_ns > 10.254.33.255:netbios_ns / NBNSQueryRequest
Ether / IP / UDP / NTP v4, client
Ether / IPv6 / UDP fe80::d8f5:7809:2d88:9800:dhcpv6_client > ff02::1:2:dhcpv6_server / DHCP6_Solicit / DHCP6OptElapsedTime / DHCP6OptClientId / DHCP6OptIA_NA / DHCP6OptClientFQDN / DHCP6OptVendorClass / DHCP6OptOptReq
Ether / IP / UDP 10.254.33.11:netbios_ns > 10.254.33.255:netbios_ns / NBNSQueryRequest
Ether / IPv6 / UDP fe80::d8f5:7809:2d88:9800:58203 > ff02::1:3:hostmon / LLMNRQuery
Ether / IPv6 / UDP fe80::d8f5:7809:2d88:9800:63559 > ff02::1:3:hostmon / LLMNRQuery
Ether / IP / UDP 10.254.33.11:63559 > 224.0.0.252:hostmon / LLMNRQuery
Ether / IPv6 / UDP fe80::d8f5:7809:2d88:9800:58203 > ff02::1:3:hostmon / LLMNRQuery
Ether / IP / UDP 10.254.33.11:58203 > 224.0.0.252:hostmon / LLMNRQuery
Ether / IPv6 / UDP fe80::d8f5:7809:2d88:9800:63559 > ff02::1:3:hostmon / LLMNRQuery
Ether / IP / UDP 10.254.33.11:63559 > 224.0.0.252:hostmon / LLMNRQuery
Ether / IP / UDP 10.254.33.11:netbios_ns > 10.254.33.255:netbios_ns / NBNSQueryRequest
Ether / IP / UDP 10.254.33.11:netbios_ns > 10.254.33.255:netbios_ns / NBNSQueryRequest
Ether / IPv6 / ICMPv6ND_RS / ICMPv6 Neighbor Discovery Option - Source Link-Layer Address a0:e4:53:cc:2d:52
Ether / IP / TCP 10.254.33.25:53676 > 199.16.156.241:https PA / Raw
Ether / IP / TCP 173.252.120.68:https > 10.254.33.11:58099 A / Padding
Ether / IP / TCP 173.252.120.68:https > 10.254.33.11:58099 PA / Raw
Ether / IP / TCP 173.252.120.68:https > 10.254.33.11:58099 PA / Raw
Ether / IP / TCP 173.252.120.68:https > 10.254.33.11:58099 A / Padding
Ether / IP / TCP 173.252.120.68:https > 10.254.33.11:58099 PA / Raw
Ether / ARP is at 70:ca:9b:77:ac:7e says 10.254.33.1 / Padding
Ether / IP / TCP 173.252.120.68:https > 10.254.33.11:58099 PA / Raw
Ether / IP / TCP 173.252.120.68:https > 10.254.33.11:58099 PA / Raw
Ether / IP / UDP / DNS Qry "syndication.twitter.com." 
Ether / IP / TCP 173.252.120.68:https > 10.254.33.11:58099 A / Padding
Ether / IP / TCP 173.252.120.68:https > 10.254.33.11:58099 PA / Raw
Ether / IP / TCP 173.252.120.68:https > 10.254.33.11:58099 A / Padding
Ether / IP / TCP 173.252.120.68:https > 10.254.33.11:58099 PA / Raw
Ether / IP / TCP 173.252.120.68:https > 10.254.33.11:58099 PA / Raw
Ether / IP / TCP 173.252.120.68:https > 10.254.33.11:58099 A / Padding
Ether / IP / TCP 173.252.120.68:https > 10.254.33.11:58099 PA / Raw
Ether / IP / TCP 173.252.120.68:https > 10.254.33.11:58099 PA / Raw
Ether / IP / TCP 173.252.120.68:https > 10.254.33.11:58099 PA / Raw
Ether / IP / TCP 173.252.120.68:https > 10.254.33.11:58099 PA / Raw
Ether / IP / TCP 173.252.120.68:https > 10.254.33.11:58099 PA / Raw
Ether / IP / TCP 173.252.120.68:https > 10.254.33.11:58099 PA / Raw
Ether / IP / TCP 173.252.120.68:https > 10.254.33.11:58099 PA / Raw
Ether / IP / TCP 173.252.120.68:https > 10.254.33.11:58099 PA / Raw
Ether / IP / UDP / DNS Qry "syndication.twitter.com." 
Ether / IP / TCP 10.254.33.25:53676 > 199.16.156.241:https PA / Raw
Ether / ARP is at 70:ca:9b:77:ac:7e says 10.254.33.1 / Padding
Ether / IP / UDP 10.254.33.25:mdns > 224.0.0.251:mdns / Raw
Ether / IP / TCP 131.253.34.243:https > 10.254.33.11:52605 PA / Raw
Ether / IP / UDP / DNS Qry "syndication.twitter.com." 
Ether / IP / TCP 10.254.33.25:59785 > 109.234.154.53:9001 S
Ether / IPv6 / UDP fe80::6236:ddff:fe96:9ed4:mdns > ff02::fb:mdns / Raw
Ether / IP / UDP 10.254.33.11:netbios_ns > 10.254.33.255:netbios_ns / NBNSQueryRequest
Ether / IP / UDP 10.254.33.11:62754 > 224.0.0.252:hostmon / LLMNRQuery
Ether / IPv6 / UDP fe80::d8f5:7809:2d88:9800:57800 > ff02::1:3:hostmon / LLMNRQuery
Ether / IP / UDP / DNS Qry "www.facebook.com." 
Ether / IP / UDP 10.254.33.11:62754 > 224.0.0.252:hostmon / LLMNRQuery
Ether / IP / UDP 10.254.33.11:57800 > 224.0.0.252:hostmon / LLMNRQuery
Ether / IP / UDP 10.254.33.11:netbios_ns > 10.254.33.255:netbios_ns / NBNSQueryRequest
Ether / IP / UDP 10.254.33.11:netbios_ns > 10.254.33.255:netbios_ns / NBNSQueryRequest
Ether / IP / UDP 10.254.33.25:netbios_ns > 10.254.33.255:netbios_ns / NBNSQueryRequest
Ether / IP / UDP / DNS Qry "syndication.twitter.com." 
Ether / IP / UDP 10.254.33.25:netbios_ns > 10.254.33.255:netbios_ns / NBNSQueryRequest
Ether / IP / UDP 10.254.33.25:netbios_ns > 10.254.33.255:netbios_ns / NBNSQueryRequest
Ether / IP / TCP 173.252.120.68:https > 10.254.33.11:58099 PA / Raw
Ether / IP / TCP 173.252.120.68:https > 10.254.33.11:58099 PA / Raw
Ether / IP / TCP 173.252.120.68:https > 10.254.33.11:58099 A / Padding
Ether / IP / TCP 173.252.120.68:https > 10.254.33.11:58099 PA / Raw
Ether / IP / TCP 173.252.120.68:https > 10.254.33.11:58099 PA / Raw
Ether / IP / TCP 173.252.120.68:https > 10.254.33.11:58099 PA / Raw
Ether / IP / TCP 173.252.120.68:https > 10.254.33.11:58099 A / Padding
Ether / IP / TCP 173.252.120.68:https > 10.254.33.11:58099 PA / Raw
Ether / IP / TCP 173.252.120.68:https > 10.254.33.11:58099 PA / Raw
Ether / IP / TCP 173.252.120.68:https > 10.254.33.11:58099 PA / Raw
Ether / IP / TCP 173.252.120.68:https > 10.254.33.11:58099 A / Padding
Ether / IP / TCP 173.252.120.68:https > 10.254.33.11:58099 PA / Raw
Ether / IP / TCP 173.252.120.68:https > 10.254.33.11:58099 PA / Raw
Ether / IP / TCP 173.252.120.68:https > 10.254.33.11:58099 PA / Raw
Ether / IP / TCP 173.252.120.68:https > 10.254.33.11:58099 PA / Raw
Ether / IP / TCP 173.252.120.68:https > 10.254.33.11:58099 PA / Raw
Ether / IP / TCP 173.252.120.68:https > 10.254.33.11:58099 PA / Raw
Ether / IP / UDP / DNS Qry "www.facebook.com." 
Ether / IP / TCP 173.252.120.68:https > 10.254.33.11:58099 PA / Raw
Ether / IP / UDP 10.254.33.25:netbios_ns > 10.254.33.255:netbios_ns / NBNSQueryRequest
Ether / IP / TCP 173.252.120.68:https > 10.254.33.11:58099 PA / Raw
Ether / IP / TCP 173.252.120.68:https > 10.254.33.11:58099 PA / Raw
Ether / IP / TCP 173.252.120.68:https > 10.254.33.11:58099 PA / Raw
Ether / IP / TCP 173.252.120.68:https > 10.254.33.11:58099 PA / Raw
Ether / IP / TCP 173.252.120.68:https > 10.254.33.11:58099 PA / Raw
Ether / IP / UDP / DNS Qry "syndication.twitter.com." 
Ether / IP / TCP 10.254.33.25:53676 > 199.16.156.241:https PA / Raw
Ether / IP / TCP 10.254.33.25:46650 > 176.9.232.116:https PA / Raw
Ether / IP / UDP / DNS Ans "googleapis.l.google.com." 
Ether / IP / UDP / DNS Qry "www.facebook.com." 
Ether / IP / TCP 10.254.33.25:46650 > 176.9.232.116:https PA / Raw
Ether / IP / TCP 10.254.33.25:46650 > 176.9.232.116:https PA / Raw
Ether / IP / UDP / DNS Qry "syndication.twitter.com." 
Ether / IPv6 / UDP fe80::d8f5:7809:2d88:9800:dhcpv6_client > ff02::1:2:dhcpv6_server / DHCP6_Solicit / DHCP6OptElapsedTime / DHCP6OptClientId / DHCP6OptIA_NA / DHCP6OptClientFQDN / DHCP6OptVendorClass / DHCP6OptOptReq
Ether / IP / TCP 173.252.74.69:http > 10.254.33.52:43891 SA
Ether / IP / TCP 173.252.74.69:http > 10.254.33.52:43891 A
Ether / IP / TCP 173.252.74.69:http > 10.254.33.52:43891 PA / Raw
Ether / IP / TCP 173.252.74.69:http > 10.254.33.52:43891 FA
Ether / IP / TCP 173.252.74.69:http > 10.254.33.52:43891 A
Ether / ARP who has 10.254.33.1 says 10.254.33.25
Ether / IP / TCP 10.254.33.25:53676 > 199.16.156.241:https FPA / Raw
Ether / ARP who has 10.254.33.1 says 10.254.33.25
Ether / IP / UDP / DNS Qry "www.facebook.com." 
Ether / ARP who has 10.254.33.1 says 10.254.33.25
Ether / IP / TCP 10.254.33.25:46650 > 176.9.232.116:https PA / Raw
Ether / IP / TCP 31.13.73.7:https > 10.254.33.11:58100 A / Padding
Ether / IP / UDP 10.254.33.25:netbios_dgm > 10.254.33.255:netbios_dgm / NBTDatagram / Raw
Ether / IP / TCP 31.13.73.7:https > 10.254.33.11:58110 A / Padding
Ether / IP / TCP 173.252.120.6:https > 10.254.33.11:58094 A / Padding
Ether / ARP who has 10.254.33.1 says 10.254.33.25
Ether / IP / UDP 10.254.33.25:netbios_dgm > 10.254.33.255:netbios_dgm / NBTDatagram / Raw
Ether / ARP who has 10.254.33.1 says 10.254.33.25
Ether / ARP who has 10.254.33.1 says 10.254.33.25
Ether / IP / UDP 10.254.33.25:netbios_dgm > 10.254.33.255:netbios_dgm / NBTDatagram / Raw
Ether / IP / TCP 173.252.120.6:https > 10.254.33.11:58094 PA / Raw
Ether / IP / TCP 173.252.120.6:https > 10.254.33.11:58094 PA / Raw
Ether / IP / TCP 173.252.120.6:https > 10.254.33.11:58094 A / Padding
Ether / IP / TCP 173.252.120.6:https > 10.254.33.11:58094 PA / Raw
Ether / IP / TCP 173.252.120.6:https > 10.254.33.11:58094 PA / Raw
Ether / IP / TCP 173.252.120.6:https > 10.254.33.11:58094 PA / Raw
Ether / IP / TCP 173.252.120.6:https > 10.254.33.11:58094 PA / Raw
Ether / IP / UDP 10.254.33.25:netbios_dgm > 10.254.33.255:netbios_dgm / NBTDatagram / Raw
Ether / ARP who has 10.254.33.1 says 10.254.33.25
Ether / ARP who has 10.254.33.1 says 10.254.33.25
Ether / IP / UDP 10.254.33.25:netbios_dgm > 10.254.33.255:netbios_dgm / NBTDatagram / Raw
Ether / IP / UDP 10.254.33.25:netbios_ns > 10.254.33.255:netbios_ns / NBNSQueryRequest / Raw
Ether / ARP who has 10.254.33.1 says 10.254.33.25
Ether / IP / TCP 173.252.120.68:https > 10.254.33.11:58099 A / Padding
Ether / IP / TCP 173.252.120.68:https > 10.254.33.11:58099 PA / Raw
Ether / IP / TCP 173.252.120.68:https > 10.254.33.11:58099 PA / Raw
Ether / IP / TCP 173.252.120.68:https > 10.254.33.11:58099 A / Padding
Ether / IP / TCP 173.252.120.68:https > 10.254.33.11:58099 PA / Raw
Ether / IP / TCP 173.252.120.68:https > 10.254.33.11:58099 A / Padding
Ether / IP / TCP 173.252.120.68:https > 10.254.33.11:58099 PA / Raw
Ether / IP / TCP 173.252.120.68:https > 10.254.33.11:58099 PA / Raw
Ether / IP / TCP 173.252.120.68:https > 10.254.33.11:58099 PA / Raw
Ether / IP / TCP 173.252.120.68:https > 10.254.33.11:58099 PA / Raw
Ether / IP / TCP 173.252.120.68:https > 10.254.33.11:58099 A / Raw
Ether / IP / TCP 173.252.120.68:https > 10.254.33.11:58099 PA / Raw
Ether / IP / TCP 173.252.120.68:https > 10.254.33.11:58099 PA / Raw
Ether / IP / UDP 10.254.33.25:netbios_ns > 10.254.33.255:netbios_ns / NBNSQueryRequest / Raw
Ether / IP / UDP 10.254.33.25:netbios_ns > 10.254.33.255:netbios_ns / NBNSQueryRequest / Raw
Ether / IP / TCP 31.13.73.7:https > 10.254.33.11:58100 A / Padding
Ether / IP / TCP 31.13.73.7:https > 10.254.33.11:58100 PA / Raw
Ether / IP / TCP 31.13.73.7:https > 10.254.33.11:58100 PA / Raw
Ether / IP / TCP 31.13.73.7:https > 10.254.33.11:58100 PA / Raw
Ether / IP / TCP 31.13.73.7:https > 10.254.33.11:58100 PA / Raw
Ether / IP / TCP 31.13.73.7:https > 10.254.33.11:58100 PA / Raw
Ether / IP / TCP 31.13.73.7:https > 10.254.33.11:58100 PA / Raw
Ether / IP / TCP 31.13.73.7:https > 10.254.33.11:58100 PA / Raw
Ether / IP / TCP 31.13.73.7:https > 10.254.33.11:58100 PA / Raw
Ether / IP / TCP 31.13.73.7:https > 10.254.33.11:58100 PA / Raw
Ether / ARP who has 10.254.33.1 says 10.254.33.25
Ether / ARP is at 70:ca:9b:77:ac:7e says 10.254.33.1 / Padding
Ether / IP / UDP 10.254.33.25:netbios_ns > 10.254.33.255:netbios_ns / NBNSQueryRequest / Raw
Ether / IP / UDP 10.254.33.25:netbios_ns > 10.254.33.255:netbios_ns / NBNSQueryRequest / Raw
Ether / ARP who has 10.254.33.1 says 10.254.33.25
Ether / ARP who has 10.254.33.1 says 10.254.33.25
Ether / IP / UDP 10.254.33.25:netbios_ns > 10.254.33.255:netbios_ns / NBNSQueryRequest / Raw
Ether / IP / UDP 10.254.33.25:netbios_ns > 10.254.33.255:netbios_ns / NBNSQueryRequest / Raw
Ether / ARP who has 10.254.33.1 says 10.254.33.25
Ether / IP / TCP 158.85.58.111:http > 10.254.33.52:58829 SA
Ether / IP / UDP 10.254.33.25:netbios_ns > 10.254.33.255:netbios_ns / NBNSQueryRequest / Raw
Ether / IP / UDP 10.254.33.25:netbios_dgm > 10.254.33.255:netbios_dgm / NBTDatagram / Raw
Ether / IP / UDP 10.254.33.25:netbios_dgm > 10.254.33.255:netbios_dgm / NBTDatagram / Raw
Ether / IP / UDP 10.254.33.25:netbios_dgm > 10.254.33.255:netbios_dgm / NBTDatagram / Raw
Ether / ARP who has 10.254.33.1 says 10.254.33.25
Ether / ARP who has 10.254.33.1 says 10.254.33.25
Ether / ARP who has 10.254.33.1 says 10.254.33.25
Ether / ARP who has 10.254.33.1 says 10.254.33.25
Ether / IP / TCP 31.13.73.7:https > 10.254.33.11:58110 PA / Raw
Ether / IP / TCP 31.13.73.7:https > 10.254.33.11:58110 PA / Raw
Ether / IP / TCP 31.13.73.7:https > 10.254.33.11:58110 FA / Padding
Ether / ARP who has 10.254.33.1 says 10.254.33.25
Ether / ARP who has 10.254.33.1 says 10.254.33.25
Ether / IP / UDP / DNS Ans "clients.l.google.com." 
Ether / IP / TCP 172.217.28.78:https > 10.254.33.11:58112 SA
Ether / IP / UDP 10.254.33.11:netbios_ns > 10.254.33.255:netbios_ns / NBNSQueryRequest
Ether / IPv6 / UDP fe80::d8f5:7809:2d88:9800:64009 > ff02::1:3:hostmon / LLMNRQuery
Ether / IP / TCP 172.217.28.78:https > 10.254.33.11:58112 SA
Ether / IP / TCP 172.217.28.78:https > 10.254.33.11:58112 A / Padding
Ether / IP / UDP 10.254.33.11:64009 > 224.0.0.252:hostmon / LLMNRQuery
Ether / IP / TCP 172.217.28.78:https > 10.254.33.11:58112 A / Raw
Ether / IP / TCP 172.217.28.78:https > 10.254.33.11:58112 A / Raw
Ether / IP / TCP 172.217.28.78:https > 10.254.33.11:58112 PA / Raw
Ether / IP / TCP 172.217.28.78:https > 10.254.33.11:58112 PA / Raw
Ether / IP / TCP 172.217.28.78:https > 10.254.33.11:58112 A / Padding
Ether / IP / TCP 172.217.28.78:https > 10.254.33.11:58112 PA / Raw
Ether / IP / TCP 172.217.28.78:https > 10.254.33.11:58112 PA / Raw
Ether / IP / TCP 172.217.28.78:https > 10.254.33.11:58112 A / Padding
Ether / IP / TCP 172.217.28.78:https > 10.254.33.11:58112 PA / Raw
Ether / IPv6 / UDP fe80::d8f5:7809:2d88:9800:64009 > ff02::1:3:hostmon / LLMNRQuery
Ether / ARP who has 10.254.33.1 says 10.254.33.25
Ether / IP / TCP 172.217.28.78:https > 10.254.33.11:58112 A / Padding
Ether / IP / TCP 172.217.28.78:https > 10.254.33.11:58112 PA / Raw
Ether / IP / TCP 172.217.28.78:https > 10.254.33.11:58112 PA / Raw
Ether / IP / TCP 172.217.28.78:https > 10.254.33.11:58112 A / Padding
Ether / ARP who has 10.254.33.1 says 10.254.33.25
Ether / IP / TCP 131.253.34.243:https > 10.254.33.11:52605 PA / Raw
Ether / ARP who has 10.254.33.1 says 10.254.33.25
Ether / ARP who has 10.254.33.1 says 10.254.33.25
Ether / ARP who has 10.254.33.1 says 10.254.33.25
Ether / ARP who has 10.254.33.1 says 10.254.33.25
Ether / 10.254.33.2 > 224.0.0.1 igmp / Raw / Padding
Ether / 10.254.33.2 > 224.0.0.1 igmp / Raw / Padding
Ether / IP / TCP 173.252.120.68:https > 10.254.33.11:58099 A / Padding
Ether / IP / TCP 173.252.120.68:https > 10.254.33.11:58099 PA / Raw
Ether / IP / TCP 173.252.120.68:https > 10.254.33.11:58099 PA / Raw
Ether / IP / TCP 173.252.120.68:https > 10.254.33.11:58099 PA / Raw
Ether / IP / TCP 173.252.120.68:https > 10.254.33.11:58099 A / Padding
Ether / IP / TCP 173.252.120.68:https > 10.254.33.11:58099 PA / Raw
Ether / IP / TCP 173.252.120.68:https > 10.254.33.11:58099 A / Padding
Ether / IP / TCP 173.252.120.68:https > 10.254.33.11:58099 PA / Raw
Ether / IP / TCP 173.252.120.68:https > 10.254.33.11:58099 PA / Raw
Ether / IP / TCP 173.252.120.68:https > 10.254.33.11:58099 PA / Raw
Ether / IP / TCP 173.252.120.68:https > 10.254.33.11:58099 A / Padding
Ether / IP / TCP 173.252.120.68:https > 10.254.33.11:58099 PA / Raw
Ether / IP / TCP 173.252.120.68:https > 10.254.33.11:58099 PA / Raw
Ether / IP / TCP 173.252.120.68:https > 10.254.33.11:58099 PA / Raw
Ether / IP / TCP 173.252.120.68:https > 10.254.33.11:58099 A / Padding
Ether / IP / TCP 173.252.120.68:https > 10.254.33.11:58099 PA / Raw
Ether / IP / TCP 173.252.120.68:https > 10.254.33.11:58099 PA / Raw
Ether / IP / TCP 173.252.120.68:https > 10.254.33.11:58099 PA / Raw
Ether / ARP who has 10.254.33.1 says 10.254.33.25
Ether / 10.254.33.2 > 224.0.0.1 igmp / Raw / Padding
Ether / 10.254.33.2 > 224.0.0.1 igmp / Raw / Padding
Ether / 10.254.33.2 > 224.0.0.1 igmp / Raw / Padding
Ether / 10.254.33.2 > 224.0.0.1 igmp / Raw / Padding
Ether / IP / TCP 173.252.120.68:https > 10.254.33.11:58099 PA / Raw
Ether / IP / TCP 173.252.120.68:https > 10.254.33.11:58099 PA / Raw
Ether / IP / TCP 173.252.120.68:https > 10.254.33.11:58099 PA / Raw
Ether / IP / TCP 173.252.120.68:https > 10.254.33.11:58099 PA / Raw
Ether / IP / TCP 173.252.120.68:https > 10.254.33.11:58099 PA / Raw
Ether / IP / TCP 173.252.120.68:https > 10.254.33.11:58099 PA / Raw
Ether / IP / TCP 173.252.120.68:https > 10.254.33.11:58099 PA / Raw
Ether / IP / TCP 173.252.120.68:https > 10.254.33.11:58099 PA / Raw
Ether / IP / TCP 173.252.120.68:https > 10.254.33.11:58099 PA / Raw
Ether / IP / TCP 173.252.120.68:https > 10.254.33.11:58099 PA / Raw
Ether / IP / TCP 173.252.120.68:https > 10.254.33.11:58099 A / Padding
Ether / IP / TCP 173.252.120.68:https > 10.254.33.11:58099 PA / Raw
Ether / IP / TCP 173.252.120.68:https > 10.254.33.11:58099 A / Padding
Ether / IP / TCP 173.252.120.68:https > 10.254.33.11:58099 PA / Raw
Ether / IP / TCP 173.252.120.68:https > 10.254.33.11:58099 A / Raw
Ether / IP / TCP 173.252.120.68:https > 10.254.33.11:58099 PA / Raw
Ether / IP / TCP 173.252.120.68:https > 10.254.33.11:58099 PA / Raw
Ether / IP / TCP 173.252.120.68:https > 10.254.33.11:58099 PA / Raw
Ether / IP / TCP 173.252.120.68:https > 10.254.33.11:58099 PA / Raw
Ether / 10.254.33.2 > 224.0.0.1 igmp / Raw / Padding
Ether / ARP who has 10.254.33.1 says 10.254.33.25
Ether / 10.254.33.2 > 224.0.0.1 igmp / Raw / Padding
Ether / 10.254.33.2 > 224.0.0.1 igmp / Raw / Padding
Ether / IP / UDP 10.254.33.1:bootps > 10.254.33.37:bootpc / BOOTP / DHCP
Ether / IP / UDP 10.254.33.1:bootps > 10.254.33.37:bootpc / BOOTP / DHCP
Ether / ARP is at 70:ca:9b:77:ac:7e says 10.254.33.1 / Padding
Ether / IP / TCP 216.58.222.14:http > 10.254.33.37:60131 SA
Ether / IP / TCP 216.58.222.14:http > 10.254.33.37:60131 A
Ether / IP / TCP 216.58.222.14:http > 10.254.33.37:60131 PA / Raw
Ether / IP / TCP 173.252.120.68:https > 10.254.33.11:58099 A / Padding
Ether / IP / TCP 173.252.120.68:https > 10.254.33.11:58099 PA / Raw
Ether / IP / TCP 173.252.120.68:https > 10.254.33.11:58099 A / Raw
Ether / IP / TCP 216.58.222.14:http > 10.254.33.37:60131 PA / Raw
Ether / IP / TCP 173.252.120.68:https > 10.254.33.11:58099 A / Padding
Ether / IP / TCP 173.252.120.68:https > 10.254.33.11:58099 PA / Raw
Ether / IP / TCP 173.252.120.68:https > 10.254.33.11:58099 A / Raw
Ether / IP / TCP 173.252.120.68:https > 10.254.33.11:58099 A / Padding
Ether / IP / TCP 173.252.120.68:https > 10.254.33.11:58099 PA / Raw
Ether / IP / TCP 173.252.120.68:https > 10.254.33.11:58099 A / Raw
Ether / IP / TCP 216.58.222.14:http > 10.254.33.37:60131 FA
Ether / IP / TCP 173.252.120.68:https > 10.254.33.11:58099 A / Padding
Ether / IP / TCP 216.58.222.14:http > 10.254.33.37:60131 A
Ether / IP / TCP 173.252.120.68:https > 10.254.33.11:58099 PA / Raw
Ether / IP / TCP 173.252.120.68:https > 10.254.33.11:58099 A / Raw
Ether / IP / TCP 173.252.120.68:https > 10.254.33.11:58099 PA / Raw
Ether / IP / TCP 173.252.120.68:https > 10.254.33.11:58099 A / Raw
Ether / IP / TCP 173.252.120.68:https > 10.254.33.11:58099 PA / Raw
Ether / IP / TCP 173.252.120.68:https > 10.254.33.11:58099 A / Raw
Ether / IP / TCP 173.252.120.68:https > 10.254.33.11:58099 A / Raw
Ether / IP / TCP 173.252.120.68:https > 10.254.33.11:58099 A / Raw
Ether / IP / TCP 173.252.120.68:https > 10.254.33.11:58099 A / Raw
Ether / IP / TCP 173.252.120.68:https > 10.254.33.11:58099 A / Raw
Ether / IP / TCP 173.252.120.68:https > 10.254.33.11:58099 PA / Raw
Ether / IPv6 / ICMPv6 Neighbor Discovery - Neighbor Solicitation (tgt: fe80::1e56:feff:fea8:ac0c)
Ether / 10.254.33.2 > 224.0.0.1 igmp / Raw / Padding
Ether / :: > ff02::16 (0) / IPv6ExtHdrHopByHop / Raw
Ether / IP / UDP 0.0.0.0:bootpc > 255.255.255.255:bootps / BOOTP / DHCP
Ether / 10.254.33.2 > 224.0.0.1 igmp / Raw / Padding
Ether / 10.254.33.2 > 224.0.0.1 igmp / Raw / Padding
Ether / IPv6 / ICMPv6ND_RS / ICMPv6 Neighbor Discovery Option - Source Link-Layer Address 1c:56:fe:a8:ac:0c
Ether / 10.254.33.2 > 224.0.0.1 igmp / Raw / Padding
Ether / IPv6 / ICMPv6ND_RS / ICMPv6 Neighbor Discovery Option - Source Link-Layer Address 1c:56:fe:a8:ac:0c
Ether / IP / UDP 10.254.33.1:bootps > 10.254.33.60:bootpc / BOOTP / DHCP
Ether / IP / UDP 0.0.0.0:bootpc > 255.255.255.255:bootps / BOOTP / DHCP
Ether / ARP who has 10.254.33.1 says 10.254.33.25
Ether / ARP who has 10.254.33.64 says 10.254.33.1 / Padding
Ether / IP / UDP / DNS Qry "comunidad.aulafacil.com." 
Ether / IP / UDP 0.0.0.0:bootpc > 255.255.255.255:bootps / BOOTP / DHCP
Ether / :: > ff02::16 (0) / IPv6ExtHdrHopByHop / Raw
Ether / IP / UDP / DNS Qry "www.facebook.com." 
Ether / ARP is at 70:ca:9b:77:ac:7e says 10.254.33.1 / Padding
Ether / IP / UDP 10.254.33.1:bootps > 10.254.33.60:bootpc / BOOTP / DHCP
Ether / :: > ff02::16 (0) / IPv6ExtHdrHopByHop / Raw
Ether / ARP who has 10.254.33.1 says 10.254.33.60 / Padding
Ether / IP / UDP 0.0.0.0:bootpc > 255.255.255.255:bootps / BOOTP / DHCP
Ether / :: > ff02::16 (0) / IPv6ExtHdrHopByHop / Raw
Ether / IP / UDP / DNS Qry "syndication.twitter.com." 
Ether / :: > ff02::16 (0) / IPv6ExtHdrHopByHop / Raw
Ether / IP / UDP 10.254.33.1:bootps > 10.254.33.64:bootpc / BOOTP / DHCP
Ether / IP / UDP 10.254.33.1:bootps > 10.254.33.64:bootpc / BOOTP / DHCP
Ether / IP / UDP / DNS Ans "android.l.google.com." 
Ether / IP / UDP 10.254.33.1:bootps > 10.254.33.64:bootpc / BOOTP / DHCP
Ether / IP / UDP 10.254.33.1:bootps > 10.254.33.64:bootpc / BOOTP / DHCP
Ether / IP / UDP / DNS Qry "www.aulafacil.com." 
Ether / IPv6 / ICMPv6ND_RS / ICMPv6 Neighbor Discovery Option - Source Link-Layer Address 60:e7:01:94:9c:8f
Ether / IP / UDP 0.0.0.0:bootpc > 255.255.255.255:bootps / BOOTP / DHCP
Ether / IP / UDP 10.254.33.1:bootps > 10.254.33.64:bootpc / BOOTP / DHCP
Ether / ARP is at 70:ca:9b:77:ac:7e says 10.254.33.1 / Padding
Ether / IP / UDP 10.254.33.1:bootps > 10.254.33.64:bootpc / BOOTP / DHCP
Ether / IP / UDP 0.0.0.0:bootpc > 255.255.255.255:bootps / BOOTP / DHCP
Ether / IP / UDP / DNS Ans "mqtt.c10r.facebook.com." 
Ether / IP / UDP / DNS Ans "clients.l.google.com." 
Ether / IP / TCP 172.217.28.78:http > 10.254.33.60:35599 SA
Ether / IP / TCP 172.217.28.78:http > 10.254.33.60:35599 A
Ether / IP / TCP 172.217.28.78:http > 10.254.33.60:35599 PA / Raw
Ether / IP / TCP 172.217.28.78:http > 10.254.33.60:35599 FA
Ether / IP / TCP 172.217.28.78:http > 10.254.33.60:35600 SA
Ether / IP / TCP 172.217.28.78:http > 10.254.33.60:35600 PA / Raw
Ether / IP / TCP 172.217.28.78:http > 10.254.33.60:35600 FA
Ether / IP / UDP 0.0.0.0:bootpc > 255.255.255.255:bootps / BOOTP / DHCP
Ether / IP / TCP 172.217.28.78:http > 10.254.33.60:35600 A
Ether / IP / UDP / DNS Qry "damian-laptop." 
Ether / IP / UDP / DNS Ans "clients.l.google.com." 
Ether / IP / TCP 172.217.28.78:http > 10.254.33.64:56229 SA
Ether / IP / TCP 172.217.28.78:http > 10.254.33.64:56229 A
Ether / IP / TCP 172.217.28.78:http > 10.254.33.64:56229 PA / Raw
Ether / IP / TCP 172.217.28.78:http > 10.254.33.64:56229 FA
Ether / IPv6 / ICMPv6 Neighbor Discovery - Neighbor Solicitation (tgt: fe80::a670:d6ff:fe0d:653f)
Ether / IP / TCP 172.217.28.78:http > 10.254.33.64:56229 A
Ether / IP / TCP 172.217.28.78:http > 10.254.33.64:51784 SA
Ether / IP / TCP 172.217.28.78:http > 10.254.33.64:51784 A
Ether / IP / TCP 172.217.28.78:http > 10.254.33.64:51784 PA / Raw
Ether / IP / TCP 172.217.28.78:http > 10.254.33.64:51784 FA
Ether / IP / TCP 172.217.28.78:http > 10.254.33.64:51784 A
Ether / IP / TCP 172.217.28.78:http > 10.254.33.60:35601 SA
Ether / IP / TCP 10.254.33.25:46650 > 176.9.232.116:https PA / Raw
Ether / IP / TCP 172.217.28.78:http > 10.254.33.60:35601 A
Ether / IP / TCP 172.217.28.78:http > 10.254.33.60:35601 PA / Raw
Ether / IP / TCP 172.217.28.78:http > 10.254.33.60:35601 FA
Ether / IP / TCP 172.217.28.78:http > 10.254.33.60:35601 A
Ether / IP / UDP / DNS Ans "z-m.facebook.com." 
Ether / IP / TCP 173.252.120.68:https > 10.254.33.11:58099 PA / Raw
Ether / IP / TCP 173.252.120.68:https > 10.254.33.11:58099 A / Padding
Ether / IP / TCP 173.252.120.68:https > 10.254.33.11:58099 PA / Raw
Ether / IP / TCP 173.252.120.68:https > 10.254.33.11:58099 PA / Raw
Ether / IP / TCP 173.252.120.68:https > 10.254.33.11:58099 PA / Raw
Ether / IP / TCP 173.252.120.68:https > 10.254.33.11:58099 PA / Raw
Ether / IP / TCP 173.252.120.68:https > 10.254.33.11:58099 PA / Raw
Ether / IP / TCP 173.252.120.68:https > 10.254.33.11:58099 PA / Raw
Ether / IP / TCP 173.252.120.68:https > 10.254.33.11:58099 PA / Raw
Ether / IP / TCP 173.252.120.68:https > 10.254.33.11:58099 PA / Raw
Ether / IP / TCP 173.252.120.68:https > 10.254.33.11:58099 PA / Raw
Ether / IP / TCP 173.252.120.68:https > 10.254.33.11:58099 PA / Raw
Ether / IP / TCP 173.252.120.68:https > 10.254.33.11:58099 PA / Raw
Ether / IP / TCP 173.252.120.68:https > 10.254.33.11:58099 PA / Raw
Ether / IP / TCP 173.252.120.68:https > 10.254.33.11:58099 PA / Raw
Ether / IP / TCP 172.217.28.78:http > 10.254.33.60:35603 SA
Ether / IP / TCP 172.217.28.78:http > 10.254.33.60:35603 A
Ether / IP / TCP 172.217.28.78:http > 10.254.33.60:35603 PA / Raw
Ether / IP / TCP 172.217.28.78:http > 10.254.33.60:35603 FA
Ether / IP / TCP 172.217.28.78:http > 10.254.33.63:53930 SA
Ether / IPv6 / ICMPv6ND_RS / ICMPv6 Neighbor Discovery Option - Source Link-Layer Address a4:70:d6:0d:65:3f
Ether / IP / TCP 172.217.28.78:http > 10.254.33.60:35603 A
Ether / IP / TCP 172.217.28.78:http > 10.254.33.63:53930 A
Ether / IP / TCP 172.217.28.78:http > 10.254.33.63:53930 FA
Ether / IP / UDP 10.254.33.64:50336 > 10.254.33.255:1900 / Raw
Ether / IP / UDP 10.254.33.64:46303 > 10.254.33.255:1900 / Raw
Ether / IP / UDP / DNS Qry "comunidad.aulafacil.com." 
Ether / ARP who has 10.254.33.1 says 10.254.33.25
Ether / IP / UDP 10.254.33.64:32886 > 10.254.33.255:1900 / Raw
Ether / IP / TCP 172.217.28.78:http > 10.254.33.60:35604 SA
Ether / IP / TCP 172.217.28.78:http > 10.254.33.60:35604 A
Ether / IP / TCP 172.217.28.78:http > 10.254.33.60:35605 A
Ether / IP / TCP 172.217.28.78:http > 10.254.33.60:35605 PA / Raw
Ether / IP / TCP 172.217.28.78:http > 10.254.33.60:35605 FA
Ether / IP / UDP 10.254.33.64:59733 > 10.254.33.255:1900 / Raw
Ether / IP / UDP / DNS Qry "www.facebook.com." 
Ether / IP / UDP / DNS Ans "mobile-gtalk.l.google.com." 
Ether / IP / UDP 10.254.33.64:54981 > 10.254.33.255:1900 / Raw
Ether / IP / TCP 172.217.28.78:http > 10.254.33.64:33399 SA
Ether / IP / TCP 172.217.28.78:http > 10.254.33.64:33399 A
Ether / IP / TCP 172.217.28.78:http > 10.254.33.64:33399 PA / Raw
Ether / IP / TCP 172.217.28.78:http > 10.254.33.64:33399 FA
Ether / IP / TCP 172.217.28.78:http > 10.254.33.64:33399 A
Ether / IP / UDP / DNS Ans "mobile-gtalk.l.google.com." 
Ether / IP / TCP 10.254.33.25:51227 > 130.185.250.68:https PA / Raw
Ether / IP / TCP 10.254.33.25:51227 > 130.185.250.68:https A / Raw
Ether / IP / TCP 10.254.33.25:51227 > 130.185.250.68:https A / Raw
Ether / IP / TCP 10.254.33.25:51227 > 130.185.250.68:https A / Raw
Ether / IP / TCP 10.254.33.25:51227 > 130.185.250.68:https A / Raw
Ether / IP / TCP 10.254.33.25:51227 > 130.185.250.68:https A / Raw
Ether / IP / TCP 10.254.33.25:51227 > 130.185.250.68:https A / Raw
Ether / IP / TCP 10.254.33.25:51227 > 130.185.250.68:https A / Raw
Ether / IP / TCP 10.254.33.25:51227 > 130.185.250.68:https A / Raw
Ether / IP / TCP 10.254.33.25:51227 > 130.185.250.68:https A / Raw
Ether / ARP who has 10.254.33.1 says 10.254.33.25
Ether / IP / UDP 10.254.33.64:35803 > 10.254.33.255:1900 / Raw
Ether / IP / UDP 10.254.33.64:47972 > 10.254.33.255:1900 / Raw
Ether / IP / TCP 172.217.28.78:http > 10.254.33.64:50210 SA
Ether / IP / TCP 172.217.28.78:http > 10.254.33.64:50210 A
Ether / IP / TCP 172.217.28.78:http > 10.254.33.64:50210 PA / Raw
Ether / IP / TCP 172.217.28.78:http > 10.254.33.64:50210 FA
Ether / IP / TCP 172.217.28.78:http > 10.254.33.64:50210 A
Ether / IP / UDP 10.254.33.64:55305 > 10.254.33.255:1900 / Raw
Ether / IP / UDP / DNS Qry "syndication.twitter.com." 
Ether / IP / UDP 10.254.33.64:44376 > 10.254.33.255:1900 / Raw
Ether / IP / TCP 172.217.28.78:http > 10.254.33.64:33028 SA
Ether / IP / TCP 172.217.28.78:http > 10.254.33.64:33028 A
Ether / IP / TCP 172.217.28.78:http > 10.254.33.64:33028 PA / Raw
Ether / IP / TCP 172.217.28.78:http > 10.254.33.64:33028 FA
Ether / IP / UDP 10.254.33.64:39750 > 10.254.33.255:1900 / Raw
Ether / IP / UDP 10.254.33.64:52408 > 10.254.33.255:1900 / Raw
Ether / IPv6 / ICMPv6ND_RS / ICMPv6 Neighbor Discovery Option - Source Link-Layer Address 1c:56:fe:a8:ac:0c
Ether / IP / UDP 10.254.33.64:48935 > 10.254.33.255:1900 / Raw
Ether / IP / UDP 10.254.33.64:35362 > 10.254.33.255:1900 / Raw
Ether / IP / UDP 10.254.33.64:55037 > 10.254.33.255:1900 / Raw
Ether / IP / UDP 10.254.33.64:57159 > 10.254.33.255:1900 / Raw
Ether / IP / UDP 10.254.33.64:50900 > 10.254.33.255:1900 / Raw
Ether / IP / UDP 10.254.33.64:51494 > 10.254.33.255:1900 / Raw
Ether / IP / UDP 10.254.33.64:46919 > 10.254.33.255:1900 / Raw
Ether / IP / UDP 10.254.33.64:34757 > 10.254.33.255:1900 / Raw
Ether / IP / UDP 10.254.33.64:52989 > 10.254.33.255:1900 / Raw
Ether / IP / UDP 10.254.33.64:59591 > 10.254.33.255:1900 / Raw
Ether / IP / UDP 10.254.33.64:43835 > 10.254.33.255:1900 / Raw
Ether / IPv6 / ICMPv6ND_RS / ICMPv6 Neighbor Discovery Option - Source Link-Layer Address 60:e7:01:94:9c:8f
Ether / IP / UDP 10.254.33.64:57752 > 10.254.33.255:1900 / Raw
Ether / IP / UDP 10.254.33.64:49129 > 10.254.33.255:1900 / Raw
Ether / IPv6 / ICMPv6ND_RS / ICMPv6 Neighbor Discovery Option - Source Link-Layer Address 1c:56:fe:a8:ac:0c
Ether / IPv6 / ICMPv6ND_RS / ICMPv6 Neighbor Discovery Option - Source Link-Layer Address a4:70:d6:0d:65:3f
Ether / IP / UDP 10.254.33.64:58830 > 10.254.33.255:1900 / Raw
Ether / IP / UDP 10.254.33.64:55053 > 10.254.33.255:1900 / Raw
Ether / IP / UDP 10.254.33.64:35490 > 10.254.33.255:1900 / Raw
Ether / IP / UDP / DNS Qry "www.twitter.com." 
Ether / ARP who has 10.254.33.1 says 10.254.33.25
Ether / IP / TCP 10.254.33.25:51227 > 130.185.250.68:https A / Raw
Ether / IP / TCP 172.217.28.78:http > 10.254.33.64:33028 FA
Ether / IPv6 / ICMPv6ND_RS / ICMPv6 Neighbor Discovery Option - Source Link-Layer Address a4:70:d6:0d:65:3f
Ether / IP / TCP 172.217.28.78:http > 10.254.33.64:33028 FA
Ether / fe80::1e56:feff:fea8:ac0c > ff02::16 (0) / IPv6ExtHdrHopByHop / Raw
Ether / ARP who has 10.254.33.1 says 10.254.33.25
Ether / IP / TCP 172.217.28.78:http > 10.254.33.64:33028 FA
Ether / ARP who has 10.254.33.1 says 10.254.33.25
Ether / ARP who has 10.254.33.1 says 10.254.33.25
Ether / ARP who has 10.254.33.1 says 10.254.33.25
Ether / IP / UDP 10.254.33.11:netbios_ns > 10.254.33.255:netbios_ns / NBNSQueryRequest
Ether / ARP who has 10.254.33.1 says 10.254.33.25
Ether / IP / TCP 172.217.28.78:http > 10.254.33.60:35606 SA
Ether / IP / TCP 172.217.28.78:http > 10.254.33.60:35606 A
Ether / IP / TCP 172.217.28.78:http > 10.254.33.60:35606 PA / Raw
Ether / IP / TCP 172.217.28.78:http > 10.254.33.60:35606 FA
Ether / IP / TCP 172.217.28.78:http > 10.254.33.60:35606 A
Ether / ARP who has 10.254.33.1 says 10.254.33.25
Ether / ARP who has 10.254.33.1 says 10.254.33.25
Ether / ARP who has 10.254.33.1 says 10.254.33.25
Ether / IP / TCP 173.252.120.6:https > 10.254.33.11:58094 A / Padding
Ether / ARP who has 10.254.33.1 says 10.254.33.25
Ether / ARP who has 10.254.33.1 says 10.254.33.25
Ether / 10.254.33.2 > 224.0.0.1 igmp / Raw / Padding
Ether / ARP who has 10.254.33.1 says 10.254.33.25
Ether / IPv6 / ICMPv6 Neighbor Discovery - Neighbor Solicitation (tgt: fe80::1e56:feff:fea8:ac0c)
Ether / :: > ff02::16 (0) / IPv6ExtHdrHopByHop / Raw
Ether / ARP is at 70:ca:9b:77:ac:7e says 10.254.33.1 / Padding
Ether / IP / UDP 0.0.0.0:bootpc > 255.255.255.255:bootps / BOOTP / DHCP
Ether / ARP who has 10.254.33.1 says 10.254.33.25
Ether / IP / UDP / DNS Ans "2800:3f0:4001:802::200e" 
Ether / IP / UDP / DNS Ans "216.58.222.14" 
Ether / IP / TCP 216.58.222.14:http > 10.254.33.37:50690 SA
Ether / IP / TCP 216.58.222.14:http > 10.254.33.37:50690 A
Ether / IP / TCP 216.58.222.14:http > 10.254.33.37:50690 PA / Raw
Ether / IP / TCP 216.58.222.14:http > 10.254.33.37:50690 FA
Ether / IP / TCP 216.58.222.14:http > 10.254.33.37:50690 A
Ether / ARP who has 10.254.33.1 says 10.254.33.37 / Padding
Ether / IPv6 / ICMPv6ND_RS / ICMPv6 Neighbor Discovery Option - Source Link-Layer Address 1c:56:fe:a8:ac:0c
Ether / IPv6 / ICMPv6ND_RS / ICMPv6 Neighbor Discovery Option - Source Link-Layer Address 1c:56:fe:a8:ac:0c
Ether / ARP who has 10.254.33.1 says 10.254.33.25
Ether / IP / TCP 173.252.120.6:https > 10.254.33.11:58094 PA / Raw
Ether / IP / TCP 173.252.120.6:https > 10.254.33.11:58094 PA / Raw
Ether / IP / TCP 31.13.73.7:https > 10.254.33.11:58100 A / Padding
Ether / IP / TCP 173.252.120.6:https > 10.254.33.11:58094 PA / Raw
Ether / IP / TCP 31.13.73.7:https > 10.254.33.11:58100 A / Padding
Ether / IP / TCP 173.252.120.6:https > 10.254.33.11:58094 A / Padding
Ether / IP / TCP 173.252.120.6:https > 10.254.33.11:58094 PA / Raw
Ether / IP / TCP 173.252.120.6:https > 10.254.33.11:58094 A / Padding
Ether / IP / TCP 173.252.120.6:https > 10.254.33.11:58094 PA / Raw
Ether / IP / TCP 173.252.120.6:https > 10.254.33.11:58094 A / Padding
Ether / IP / TCP 173.252.120.6:https > 10.254.33.11:58094 PA / Raw
Ether / IP / TCP 173.252.120.6:https > 10.254.33.11:58094 A / Padding
Ether / IP / TCP 173.252.120.6:https > 10.254.33.11:58094 PA / Raw
Ether / IP / TCP 173.252.120.6:https > 10.254.33.11:58094 PA / Raw
Ether / IP / TCP 173.252.120.6:https > 10.254.33.11:58094 PA / Raw
Ether / ARP who has 10.254.33.1 says 10.254.33.25
Ether / ARP is at 70:ca:9b:77:ac:7e says 10.254.33.1 / Padding
Ether / ARP who has 10.254.33.1 says 10.254.33.25
Ether / IP / TCP 173.252.120.68:https > 10.254.33.11:58099 A / Padding
Ether / IP / TCP 173.252.120.68:https > 10.254.33.11:58099 PA / Raw
Ether / IP / TCP 173.252.120.68:https > 10.254.33.11:58099 PA / Raw
Ether / ARP who has 10.254.33.1 says 10.254.33.25
Ether / IP / TCP 173.252.120.68:https > 10.254.33.11:58099 A / Padding
Ether / IP / TCP 173.252.120.68:https > 10.254.33.11:58099 PA / Raw
Ether / IP / TCP 173.252.120.68:https > 10.254.33.11:58099 PA / Raw
Ether / IP / TCP 173.252.120.68:https > 10.254.33.11:58099 PA / Raw
Ether / IP / TCP 173.252.120.68:https > 10.254.33.11:58099 PA / Raw
Ether / IP / TCP 173.252.120.68:https > 10.254.33.11:58099 PA / Raw
Ether / IP / TCP 173.252.120.68:https > 10.254.33.11:58099 PA / Raw
Ether / IP / TCP 173.252.120.68:https > 10.254.33.11:58099 PA / Raw
Ether / IP / TCP 173.252.120.68:https > 10.254.33.11:58099 PA / Raw
Ether / IP / TCP 173.252.120.68:https > 10.254.33.11:58099 PA / Raw
Ether / IP / TCP 173.252.120.68:https > 10.254.33.11:58099 PA / Raw
Ether / IP / TCP 173.252.120.68:https > 10.254.33.11:58099 PA / Raw
Ether / IP / TCP 173.252.120.68:https > 10.254.33.11:58099 PA / Raw
Ether / IP / TCP 173.252.120.68:https > 10.254.33.11:58099 PA / Raw
Ether / IP / TCP 173.252.120.68:https > 10.254.33.11:58099 PA / Raw
Ether / IP / TCP 173.252.120.68:https > 10.254.33.11:58099 PA / Raw
